关键词,百度手机页码,百度手机排名,百度手机标题,百度手机网址,百度手机简介
大会,2,2,2024世界人工智能大会：直面人工智能治理 千余名嘉宾“巅峰论道”,https://haokan.baidu.com/v?pd=wisenatural&vid=4995086020187661572,"峰论道” 02:55 点击进入沉浸观看 00:00 / 00:00 播放：3.4万次简介： 视频处理中,不影响文章正常发布更换封面人工智能是人类发展新领域,其快速发展对经济社会发展和人类文明进步产生了深远影响,也带来了未知风险和复杂挑战。开幕式后,大会全体会议上,1000... 看看新闻Knews7月4日近期发布"
大会,2,3,2024年奇瑞全球合作伙伴共创大会在芜湖召开,https://haokan.baidu.com/v?pd=wisenatural&vid=9203134743829384760,芜湖召开 04:45 点击进入沉浸观看 00:00 / 00:00 播放：6984次简介： 2024年奇瑞全球合作伙伴共创大会在芜湖召开 奇瑞 奇瑞全球合作伙伴 汽车 汽车资讯 车评 新能源 新生态 新时代 Mr. Nei Bush尼尔·布什 威徽旭视 安徽卫权 款视 豆徽亚频 全球... 中安在线5月1日
大会,2,4,世界智能制造大会 - wimsite.org,http://www.wimsite.org/,"域名[wimsite.org] 正在出售中,如果您对该域名感兴趣,请点击这里提供您的报价。 或联系我们。 您看到此页说明系统正在生成出售页,请稍候再试! The page will be generated soon, ... www.wimsite.org "
大会,2,5,2024世界人工智能大会暨人工智能全球治理高级别会议4日正式开幕,https://haokan.baidu.com/v?pd=wisenatural&vid=12238563763566196048,正式开幕 01:52 点击进入沉浸观看 00:00 / 00:00 播放：2万次简介： 2024世界人工智能大会暨人工智能全球治理高级别会议 球治理高级会议 平台 中信集团 球治理高级会议 正三 代码在跳动 像心跳的节奏 王青 WAIC的舞台 梦想在此刻聚首 穿梭虚与实 编织... 财联社财经达人7月4日
大会,2,6,全国苏维埃区域代表大会的历史细节,https://baijiahao.baidu.com/s?id=1792735620630586627&wfr=spider&for=pc,参加全国苏维埃区域代表大会的正式代表有48人，他们来自全国各个红色根据地和游击区，作家柔石、胡也频和柔石的夫人冯铿等代表左联也参加了会议。一些代表还要参加全国红军代表会议。当时具备... 金台资讯 
大会,2,7,全国科技大会、国家科学技术奖励大会、两院院士大会 - 中华人民共和...,https://www.most.gov.cn/ztzl/qgkjdh2023jl/,7月21日 新华社北京6月24日电 全国科技大会、国家科学技术奖励大会和中国科学院第二十一次院士大会、中国工程院第十七次院士大会24日... 中华人民共和国科学技术部 
大会,2,8,2024世界人工智能大会开幕_要闻图片_中国政府网,https://www.gov.cn/yaowen/tupian/202407/content_6961287.htm,"7月4日7月4日在2024世界人工智能大会特斯拉展位拍摄的人形机器人。 当日,2024世界人工智能大会暨人工智能全球治理高级别会议在上海开幕。本届大会的主题是“以共商促共享 以善治促善智”,主... 中国政府网 "
大会,2,9,中国共产党第二十次全国代表大会在京闭幕 习近平发表重要讲话,https://haokan.baidu.com/v?pd=wisenatural&vid=12733894782777892949,重要讲话 38:35 点击进入沉浸观看 00:00 / 00:00 播放：132万次简介： 0001.中国网络电视台-[朝闻天下]中国共产党第二十次全国代表大会在京闭幕 习近平主持大会并发表重要讲话[超清版] 中国共产党 中国共产党第二十次全国代表大会... 央视网权威媒体2022年10月24日
大会,2,10,"都知道波士顿动力的机器人会空翻,那你知道中国品牌宇树科技有多强吗?在2024世界人工智能大会 现场,他们带来的宇树 H1 不仅世界首次做到原地空翻,跑步速度还打破了世界纪录。此外,特斯拉的人形机器人 Optimus 擎天柱也来到了上海,爱范儿在现场 带你看看,记得关注!",https://quanmin.baidu.com/sv?source=share-h5&pd=qm_share_search&vid=17353764278873743467,"得关注! 01:15 点击进入沉浸观看 00:00 / 00:00 播放：1.7万次简介：在2024世界人工智能大会 现场,他们带来的宇树 H1 不仅世界首次做到原地空翻,跑步速度还打破了世界纪录。此外,特斯拉的人形机器人 Optimus 擎天柱也来到了上海,爱范儿在现场 带你看看,... 爱范儿7月4日较多评论"
