关键词,百度手机页码,百度手机排名,百度手机标题,百度手机网址,百度手机简介
营销策划,3,1,营销策划方案(精选14篇),https://www.yjbys.com/cehuashu/2973673.html,"2023年6月16日为了确保工作或事情有序地进行,就不得不需要事先制定方案,方案是有很强可操作性的书面计划。那么大家知道方案怎么写才规范吗?下面是小编为大家整理的营销策划方案,仅供参考,大家一起... 应届毕业生网 "
营销策划,3,2,营销方案策划书(精选20篇),https://www.yjbys.com/cehuashu/3624583.html,"2023年8月11日以下就是我们团队准备的营销策划方案。 二、市场环境 (一)宏观环境分析 中国的水果市场巨大,与国外人均年消费水果85公斤相比,国内人均消费才刚到其一半。通过对大多家庭的调查,80%的... 应届毕业生网 "
营销策划,3,3,营销策划方案(通用21篇),https://www.yjbys.com/cehuashu/2981420.html,"2023年5月12日营销策划方案(通用21篇) 为了确保事情或工作有效开展,往往需要预先进行方案制定工作,方案具有可操作性和可行性的特点。写方案需要注意哪些格式呢?下面是小编精心整理的营销策划方案,仅供... 应届毕业生网 "
营销策划,3,4,【热门】市场营销活动策划20篇,http://www.unjs.com/fanwenku/450137.html,"1月6日相信许多人会觉得策划书很难写吧,下面是小编帮大家整理的市场营销活动策划,仅供参考,欢迎大家阅读。市场营销活动策划 1... 优文网 "
营销策划,3,5,营销策划方案怎么写(例文10篇),https://m.51test.net/show/11004675.html,"2023年12月26日营销策划方案怎么写(例文10篇) 【#策划# #营销策划方案怎么写(例文10篇)#】营销策划方案是一种系统性的规划和策略,旨在帮助企业或品牌在市场竞争中获得优势,提高市场份额,实现商业... 无忧考网 "
营销策划,3,6,线上营销策划万能模板💯超硬核干货分享,https://mbd.baidu.com/newspage/data/dtlandingsuper?nid=dt_5586246500064594743,"2022年12月2日‼️写不好策划难怪生意惨淡,成功营销策划是开店第一步 💡但是对于开店小白来说,写营销策划是很大的挑战 一品书吧 "
营销策划,3,7,营销策划方案 (15篇),https://www.gzpinda.com/shiyongwen/cehuashu/232992.html,"2023年6月15日营销策划方案 (15篇) 为确保事情或工作顺利开展,就不得不需要事先制定方案,方案是阐明具体行动的时间,地点,目的,预期效果,预算及... www.gzpinda.com "
营销策划,3,8,营销策划方案范本(精选18篇),https://www.ruiwen.com/word/yingxiaocehuafanganfanben.html,"1. 策划目的/概述。 企业开张伊始,尚无一套系统营销方略,因而需要根据市场特点策划出一套行销计划。 2. 分析当前的营销环境状况。 (一)市场状况分析及市场前景预测 1、产品的市场性、现实市场及潜在市场状况。 2、市场成长状况,产品目前处于市场生命周期的哪3. SWOT分析。 营销方案,是对市场机会的把握和策略的运用,因此分析市场机会,就成了营销策划的关键。只是找准了市场机会,策划就成功了一半。 一般营销中存在 瑞文网 "
营销策划,3,9,"6套营销策划PPT模板,做品牌推广方案PPT,很棒很实用!",https://baijiahao.baidu.com/s?id=1789787816388860898&wfr=spider&for=pc,1. 封面标题：包含活动或项目的名称以及“营销策划方案”字样。副标题（可选）：简短描述策划的主题或目的。公司/品牌标识：放置公司logo或者项目相关的视觉元素。2. 目录简要列出PPT的主要章节和页码，方便观众快速定位内容。 电影钟点房 
营销策划,3,10,营销策划方案(精选15篇),https://www.yjbys.com/cehuashu/4193594.html,"1. 目的: 提升餐饮酒店的知名度、品牌形象 2. 主题: 主题一:“忽然遇见更美的你“为主题 此次活动的主题概念以“打破传统生活,制造浪漫惊喜”为出发点,迎合了白领们对平凡生活中浪漫的向往、3. 策略: 根据节日营销背景,我们将此次目标受众定位于20-40岁中高端人群;他们在进餐厅用餐除了希望餐点美味之外,也注重环境、氛围、文化等附加值因素;他们 应届毕业生网 "
新媒体,10,1,新优媒-新型自媒体新媒体传播平台,https://www.coc1.cn/,"新优媒网专注新媒体互联网传播站,立足于新媒体传播和优秀媒体信息整合! 新优媒 "
新媒体,10,2,浙江宣传 | 传统媒体干好新媒体需治“8种病”,https://zjnews.zjol.com.cn/zjxc/202212/t20221209_25164609.shtml,"2022年10月11日旧肌体长不出新媒体。传统媒体干不好新媒体,归根结底是因为没有转变思维观念,进化出新媒体基因。笔者以为,具体说来,有这“8种病”。 病1:自视艺高、不愿改变 ... 浙江在线·新闻 "
新媒体,10,3,前方信息-新媒体内容技术与运营服务专家,http://www.aheading.com/,"杭州前方信息技术有限公司,专注于数字出版、新媒体和移动互联网领域的专业技术公司和创新型创业公司,从事行业软件设计、数据加工、数据库开发、... 前方信息 "
新媒体,10,4,"网民在哪,政务新媒体就在哪_要闻_新闻_中国政府网",https://www.gov.cn/xinwen/2015-02/12/content_2818378.htm,"2015年2月12日令人眼花缭乱的新媒体,正日益改变着舆论格局。目前,我国手机网民已达5.57亿,移动终端正成为中国新的舆论场和沟通对话新通道。 网民在哪里,政务新媒体就在哪里。 中国政府网 "
新媒体,10,5,主流媒体新媒体内容商业化路径探索 !_账号_视频_营销,https://gov.sohu.com/a/579898556_121123774,2022年8月26日央视市场研究(CTR)总经理助理、媒体融合总经理、CTR媒体融合研究院执行副院长姜涛现场以《主流媒体新媒体内容商业化路径探索》为题发表主旨... 搜狐 
新媒体,10,6,新时代政务新媒体出圈传播的挑战与进路,https://www.lsz.gov.cn/ztzl/rdzt/wzxmtpc/mtgz_40293/202308/t20230825_2533695.html,"2023年6月5日党的二十大报告和2023年政府工作报告对政府在治理过程中实现更广泛的民主参与和更及时的民意互动提出了要求,政务新媒体在搭建公共参政议政以及政府和群众互动的桥梁、引导社会舆论、助推... 凉山彝族自治州人民政府 "
新媒体,10,7,内容为王 经典与新媒体擦出别样火花_华语_电影网_1905...,https://www.1905.com/m/news/touch/1471301.shtml,"2020年7月28日3.经典与新媒体擦出别样火花 “经典因其强大的内容穿透力和文化传承性,在互联网时代依然能够成为年轻人的精神食粮。”影评人张榆... 1905电影网 "
新媒体,10,8,新媒体运营工作必备的几个热点指数网站-腾讯云开发者...,https://cloud.tencent.com/developer/article/1538032,"2019年11月13日新媒体运营工作当然离不开热点话题,“抢热门”、“追热点”应该是最快、最容易在短时间内获得大量流量的方法。 腾讯云计算 "
新媒体,10,9,新媒体环境下市场营销策略创新发展 _光明网,https://reader.gmw.cn/2024-01/08/content_37077015.htm,"1月8日随着互联网技术的迅猛发展,新媒体已经成为人们获取信息、交流和互动的主要渠道。新媒体的兴起不仅改变了人们的生活方式,也对企业的市场营销方式提出了新的挑战和机遇。在新媒体环境下,传... 光明网 "
新媒体,10,10,《我们与恶的距离》:新媒体怎样才是真正的扬善去恶...,https://movie.douban.com/review/12514638/,"2020年4月17日不给他们机会改过自新的好人,能称之为“好人”吗?此剧能够获得豆瓣评分9.5的高分,便是认真的在为这个问题寻找合适的答案吧!1 聚焦媒体... 豆瓣电影 "
竞价,6,1,股票竞价是什么意思?-股票知识问答-我爱卡,https://www.51credit.com/wenda/813329.html,"2019年6月12日股票竞价是指集合竞价,它是对一段时间内接受的买卖申报集中起来,然后进行竞价。 集合竞价确定成交价格的原则是: 1、选择成交量大的价位; 2、和成交价格相同的卖方或买方至少一方能够... 我爱卡 "
竞价,6,2,竞价岗位职责(通用20篇),https://www.yjbys.com/hr/gangwei/4081322.html,"4月1日竞价岗位职责(通用20篇) 在社会发展不断提速的今天,我们每个人都可能会接触到岗位职责,岗位职责具有提高内部竞争活力,更好地发现和... 应届毕业生网 "
竞价,6,3,竞价是什么意思 竞价和招标的区别 网上竞价投标流程...,http://finance.tianxiagold.com/cj/2022/1128/69340.html,"2022年11月28日这使得更多的人参与集合竞价申报,使得竞价更加充分。 每个交易日上午集合竞价开盘期间,从开盘价确定前十分钟开始,每分钟透露一次可能... 天下金融网 "
竞价,6,4,百度竞价是什么意思-攻硬营销,http://www.kelaiseo.com/tuiguang/214.html,"3月4日百度竞价的优势: 1、企业可以同时推广多个产品的多个关键词,顾客在搜索其中一款产品的同时,会发现企业的其他产品,推广效果优会更好,... 客来SEO "
竞价,6,5,竞价软件市场分析:五款免费的百度SEM工具-软件技巧-ZOL软件...,https://xiazai.zol.com.cn/jiqiao/72361.html,"软件分类:网站推广 时间:2020-01-08 大小:532 KB 下面给大家推荐几款好用的免费的SEM网络竞价软件,有需要的小伙伴们来了解一下。 1.网络竞价点击器 5.1 ZOL软件下载 "
竞价,6,6,什么是竞价招标-千里马招标网,https://www.qianlima.com/news/395.html,"2023年11月15日竞价招标是一种采购方式,它通过竞争性的报价来选择供应商并确定合同价格。这种采购方式通常用于购买数量较多且价格较高的商品或服务。以下是竞价招标的基本步骤和要求: ... 千里马招标网 "
竞价,6,7,"股票竞价的时间段,股票竞价规则以及其选股方法__赢家...",http://www.yingjia360.com/gpsy/2022-04-27/61065.html,"2022年4月27日股票竞价通常是表示是进行集合竞价,这是股市进行交易的一种方式。在股票市场的交易时间分为两个阶段:集合竞价和连续竞价。其中集合竞价是指在特定时间段内,在该特定时间段内接受的销售... 赢家财富网 "
竞价,6,8,竞价和竞标的区别 理想股票技术论坛,https://www.55188.com/tag-2529544.html,"7月30日竞价和竞标是两种常见的投标方式,其中竞价是指在交易市场上以报价的形式争夺商品或服务的购买权,而竞标是指通过招标或公开拍卖等方式争夺项目或合同的承接权。竞价和竞标的区别主要体现... 理想论坛 "
竞价,6,9,竞价推广怎么入门?新手学竞价一定要先明白这4件事 |...,http://www.mysemlife.com/15759,"1. 百度竞价精细化账户结构划分原理 这里在详细说明一点,一个精细化账户指的是:每个计划下,各个推广单元内添加的关键词和关联的创意和对应的着陆页是否一一2. 百度竞价账户搭建 其实作为百度竞价推广的根基,一个合理的账户结构可以帮助我们简化90%的难题。 账户结构既是我们控制流量的工具,也是一切优化操作的根基。那3. 百度竞价撰写创意 百度竞价是一个系统化工程,在“展现—点击—抵达—线索—转化”的整个流程中 每个环节都是紧密相关的。而创意决定了访客是否会点击 赵阳SEM博客 "
竞价,6,10,集合竞价是什么意思?,https://m.v.qq.com/z/msite/play-short/index.html?qqVersion=0&vid=a0917tj87w8,"看全集高清完整版 打开小程序 打开APP 再看一遍 更多热门短视频 打开小程序 打开APP 请选择以下方式打开并播放 继续使用浏览器 腾讯视频小程序 快捷观看,清晰好用 打开 ... 腾讯视频 "
精准引流,9,1,"什么叫精准引流,2个方式3个方法教你如何去做_流量...",https://m.sohu.com/a/655921137_121630859,"2023年3月18日精准引流就是那些对你产品感兴趣的用户,带着信任来找你的粉丝。1个精准粉丝抵过1000个泛粉,只有精准粉丝才会去付费,所以我们要去做的是精准引流。 搜狐网 "
精准引流,9,2,抖音引流短视频如何带来精准流量_直播_用户_产品,https://m.sohu.com/a/591279697_723902,"2022年10月9日一定要站在用户的角度做短视频引流亮点,找出你的直播间里最吸引人的产品;为用户总结有价值的地方或者可以直接展示产品的痛点,为用户精准种草... 搜狐网 "
精准引流,9,3,精准引流方法都有哪些?如何做到精准引流_流量_定位_用户,https://m.sohu.com/a/651767925_121629366,"2023年3月9日精准引流的方法真的是太多了,相信大家也看到过不少。如果让你学引流方法,那可能学一辈子也学不完。因为互联网变化太快了,今天是知乎,抖音,明天变成了快手,小红书。不同平台规则不... 搜狐网 "
精准引流,9,4,快手怎么引流?教你正确引流精准粉的秘诀+运营策略...,https://m.sohu.com/a/787471376_121944773,"6月21日跟大家分享一个通过快手精准引流创业粉丝的实战方法。 许多人可能对快手平台有些偏见,觉得它的用户质量不行,但实际上,每个平台都有其独特的... 搜狐网 "
精准引流,9,5,揭秘!2023年最强引流推广秘籍:让你的品牌火遍全网...,https://m.sohu.com/a/799346467_122025454,"一、精准定位,找到你的“灵魂伴侣” 引流的第一步,是明确你的目标受众。通过市场调研和数据分析,了解你的潜在用户是谁,他们的兴趣点、消费习惯以及活跃在哪些平台。只有精准定位,才能... 搜狐网 "
精准引流,9,6,私域流量如何做到精准的引流_客户_用户_内容,https://m.sohu.com/a/618614553_121630102,"2022年12月18日私域流量如何做到精准的引流 随着互联网流量红利的消失,很多企业所享受的流量也达到封顶,这就导致获客的成本越来越高,再加上市场产品同质... 搜狐网 "
精准引流,9,7,"精准引流推广怎么做:精准引流推广:掌握核心策略,实现...",https://m.sohu.com/a/758344201_121799063,"2月18日在当今信息爆炸的时代,如何有效地进行引流推广,让目标客户主动找到你,成为了每个企业和个人都需要面对的问题。精准引流推广不仅能够帮助你节省... 搜狐网 "
精准引流,9,8,白杨SEO:如何快速学习精准引流怎样做?_推广,https://m.sohu.com/a/478565355_364521,"1. 什么是精准引流? 关于精准引流,其实这里要拆分为两个点即:引流与精准。引流呢,其实是吸引流量的简称。精准就不用白杨来解释了吧,精准对应反义词就2. 精准引流三个核心要点:(先说理论哈,下面后面举例) 核心要点1:明确推广目标,找到精准需求关键词 这个核心要点1怎么理解?明确推广目标,简单理解,比如你 搜狐网 "
精准引流,9,9,快手怎么做引流推广:快手引流推广攻略:从0到1打造爆款...,https://m.sohu.com/a/760076449_121799063,"1. 明确目标受众 在进行引流推广之前,首先要明确自己的目标受众是谁。通过数据分析、市场调研等方式,了解目标受众的喜好、需求和消费习惯,为后续的内容创作和推广策略2. 打造高质量内容 内容是吸引用户的核心。在快手平台上,要想吸引更多的用户,首先要打造高质量、有趣、有用的内容。创作者可以结合自己的特长和兴趣, 搜狐网 "
激活休眠,9,1,"上海成立消保基金会:公益诉讼,终于可以名正言顺地打了|...",https://m.163.com/dy/article/H2GAOM7R0514R9P4.html,"2022年3月15日业内透露,这将激活“休眠”的公益诉讼。 “也就是说,以后,公益诉讼胜诉后的赔偿款,可以交给消保基金会,这既能对企业起到威慑... 网易新闻 "
激活休眠,9,2,Windows快速启动背后的功臣:休眠 - 知乎,https://zhuanlan.zhihu.com/p/28639474,"2021年5月6日休眠文件hiberfil.sys随着你的内存大小而设定,通常是你安装内存的75%大小。土豪用户引以为傲的大内存带来了大休眠文件,对寸土寸金的SSD来说... 知乎 "
激活休眠,9,3,區分快速啟動與喚醒與休眠 - Windows drivers |...,https://learn.microsoft.com/zh-hk/windows-hardware/drivers/kernel/distinguishing-fast-startup-from-wake-from-hibernation,"2015年6月20日喚醒從休眠 快速(結合前兩個,Windows 8) 若要區別快速啟動與喚醒與休眠,核心模式設備磁碟機可以檢查系統電源 IRP。 在冷啟動期間,開機載入器會藉由將 Windows 核心檔案的區段載入記憶... Microsoft "
激活休眠,9,4,win10 睡眠、休眠、电池管理_x1c 打开 s3-CSDN博客,https://blog.csdn.net/arloor/article/details/84075181,"2018年11月14日win10 睡眠、休眠、电池管理 新入手了thinkpad x1 carbon 2018,定位轻薄便携总不能每次在外需要使用时都重新开关机,于是研究了一下win10... CSDN博客 "
激活休眠,9,5,一周论文盘点 | 女性压力大更易患阿尔茨海默病;AI出手清...,https://zhuanlan.zhihu.com/p/627435831,"2023年5月7日激活休眠细胞可帮助恢复视力 遗传性视网膜变性是由感光细胞丢失导致的,随着疾病进展,感光细胞逐渐退化并且无法再生,患者会因此视力下降甚至失明。 知乎 "
激活休眠,9,6,[Windows 11/10] 疑难解答 – 设备自动进入睡眠或休眠,https://www.asus.com.cn/support/FAQ/1051238,"5月3日3.在命令提示符中輸入「powercfg.exe /hibernate off」,然后按下Enter键以关闭休眠功能。 注:如果您希望重新启用休眠功能,只需再次使用命令提示符,以系统管理员身份执行命令「powercfg... ROG官网 "
激活休眠,9,7,"您的""休眠账户""不能再炒股了_新闻频道_中国青年网",https://t.m.youth.cn/transfer/index/url/news.youth.cn/jsxw/201706/t20170627_10172639.htm,"2017年6月27日其次,投资者申请激活休眠A股账户及对应的休眠资金账户,应提供有效身份证明文件、证券账户卡、资金账户卡等材料。证券账户卡或资金账户... 中国青年网·新闻频道 "
激活休眠,9,8,[Windows 11/10] 疑難排解 - 無法進入睡眠或休眠模式...,https://rog.asus.com/hk/support/faq/1049328/,"2月6日如果您遇到裝置無法進入睡眠或休眠模式,請參考本文的疑難排解步驟。 請依照您裝置目前的Windows作業系統版本,前往相對應的操作說明: ... For Those Who Dare "
激活休眠,9,9,Win10 睡眠/休眠问题:解决与恢复,https://tieba.baidu.com/p/8502816919,"29个回复发帖时间: 2023年07月13日 1楼: ...用命令看了发现S3休眠不支持,应该是软件问题,有朋友...5楼: win11有睡眠无休眠,好像最新版Win11砍掉了休眠 百度贴吧 "
激活休眠,9,10,[Windows 11/10] 疑難排解 - 無法進入睡眠或休眠模式...,https://rog.asus.com/tw/support/faq/1049328/,"1. 在Windows搜尋欄輸入[選擇電源計劃]①,然後點選[開啟]②。 2. 在您目前使用的電源計劃後方,點擊[變更計劃設定]③。 3. 確認在電池使用中及一般電源,讓電腦睡眠的時間是否符合您的預期④。 For Those Who Dare "
董事长,7,1,董事长  -  百度百科,https://baike.baidu.com/item/%E8%91%A3%E4%BA%8B%E9%95%BF/356514?fr=ge_ala,03:00 董事长（英语：Chairman of the board，简称：Chairman，日韩称会长），又被翻译成董事会主席。指的是一家公司的最高领导者，统领董事会。董事长也是董事之一，由董事会选出，其代表董事会领导公司的方向与策略。董事长是公司或机构的最高管理者，由董事会选举产生，为公司利益的最高代表，领导董事会。在日本和韩国的大型会社（公司）称为“会长”，名称分别为“取缔役会会长”和“理事会会长”，是股东利益的最高代表。 产生权限工作职责词义渊源 百度百科
董事长,7,2,董事长的任命和职责 - Yancoal ,https://www.yancoal.com.au/page/cn/about/boards-and-committees/chairmans-appointment-and-responsibilities/,"持有兖煤澳洲大部分已发行附有投票权股份的股东可以提名董事长,并可以选举一名或多名董事担任副董事长。 董事长领导兖煤澳洲董事会,负责有效组织兖煤董事会的工作和履行职能。 董事长... www.yancoal.com.au "
董事长,7,3,官宣!江苏一银行董事长辞任|江苏省|党委书记_网易订阅,https://m.163.com/dy/article/J8TMRN7S0530NLC9.html,"8月6日8月5日晚间,无锡银行发布公告表示,该行于近日收到董事长邵辉的书面辞职报告,因工作调动原因,其辞去该行的一切职务。据悉,邵辉已经... 网易新闻 "
董事长,7,4,"无锡银行董事长掌舵6年后辞职,原行长回归任董事",https://mp.weixin.qq.com/s?__biz=MzI2NTI4MTk0OA==&mid=2247504232&idx=2&sn=8b42201eea1bccef6ddca9bc4c407bd5&chksm=ea9d599bddead08dbce1391adffdf271c95fd155d7e9470d3c5c9fa7c64fa34ab4aa05b77a32&scene=27,"8天前8月5日晚间,无锡农村商业银行股份有限公司(简称“无锡银行”)发布公告,其董事长邵辉因工作调动辞去董事长、执行董事及董事会专门委员会相关职务。 在无锡银行发布董事长辞任公告当天,江... 微信公众平台 "
董事长,7,5,"红豆股份:董事长戴敏君辞职,周宏江接任",https://baijiahao.baidu.com/s?id=1807171463512277638&wfr=spider&for=pc,4天前红豆股份公告，公司董事长戴敏君因工作调整原因辞职。公司董事会选聘周宏江为新任董事长，任期与第九届董事会一致。周宏江曾任红豆集团南京、北京分公司经理，公司衬衫厂副厂长、西服一厂... 金融界 
董事长,7,6,董事长、总裁和 CEO 的职能有什么区别? - 知乎,https://www.zhihu.com/question/21762268,回答时间: 2013年11月22日 最佳答案：董事长、总裁和CEO的权力详解 自从信息产业兴起以来，尤其是网络股泡沫产生以来，“CEO”在中国骤然成为一个流行词汇。总经理 知乎 
董事长,7,7,李斌(蔚来创始人、董事长、CEO) - 百度百科,https://baike.baidu.com/item/%E6%9D%8E%E6%96%8C/3910111?fr=aladdin,李斌，男，汉族，1974年6月22日出生，蔚来创始人、董事长、CEO。北京大学社会学学士学位并辅修法律专业，辅修法律及计算机。1996年毕业于北京大学社会学专业。带领易车成为中国第一家在海外上市的汽车互联网公司，经过十多年发展，易车已经拥有近3000名员工、业务覆盖全国341个城市，成为中国最大的汽车互联网企业。作为易车公司创始人、董事长兼CEO，带领易车在用户需求洞察、互联网营销、汽车电商等领域进行了诸多前瞻性的实践，成为影响中国汽车互联网行业的重要人物之一。担任中国汽车流通协会（CADA）副会长，2008年，被CADA评为三十年来中国汽车流通行业最具影响力的十大杰出人物之一。荣获“2012年度AD100中国网络广告百名风云人物”称号。2014年荣获中国汽车流通行业颁发的风云人物奖。人物背景人物经历主要贡献个人生活百度百科较多分享
董事长,7,8,董建雄当选中国铝业董事长,https://www.chalco.com.cn/xwdt/ggdt/202309/t20230930_116634.html,"2023年9月30日股份有限公司召开2023年第一次临时股东大会及第八届董事会第十五次会议,经选举,董建雄当选为公司第八届董事会执行董事、董事长。 中国铝业股份有限公司 "
董事长,7,9,"宗馥莉还未接手娃哈哈集团股份!既不是副董事长,也不是...",https://baijiahao.baidu.com/s?id=1804892417308454131&wfr=spider&for=pc,据传，近期，杭州市上城区人民政府及杭州娃哈哈集团有限公司（简称“娃哈哈集团”）部分股东就本人（宗馥莉）自宗庆后董事长离世后，对... 和讯网 
董事长,7,10,董事长 - 百度百科,https://baike.baidu.com/item/%E8%91%A3%E4%BA%8B%E9%95%BF/356514?fr=aladdin,董事长（英语：Chairman of the board，简称：Chairman，日韩称会长），又被翻译成董事会主席。指的是一家公司的最高领导者，统领董事会。董事长也是董事之一，由董事会选出，其代表董事会领导公司的方向与策略。董事长是公司或机构的最高管理者，由董事会选举产生，为公司利益的最高代表，领导董事会。在日本和韩国的大型会社（公司）称为“会长”，名称分别为“取缔役会会长”和“理事会会长”，是股东利益的最高代表。 产生权限工作职责词义渊源百度百科
大会,2,1,会议场地出租_酒店会议室预定_活动场地租赁_会议服务...,https://www.huizone.com/,"3月28日至29日,2024年“第九届排水大会——城市污水提质增效及水环... 厦门翔鹭国际大酒店 2024/07/03 ... 会掌柜 "
