Title,URL,Author,Source,Date,Database,Quote,Keywords,Abstract
Diagnostic Value of Contrast-enhanced Ultrasonography Combined with Conventional Ultrasound in Benign and Malignant Solitary Thyroid Nodules with Chronic Lymphocytic Thyroiditis,https://www.cnki.net/KCMS/detail/detail.aspx?dbcode=CJFD&filename=YXYZ201503029,"Yang Juan;Wu Changcai;Yan Shuhong;Department of Ultrasound Center,Affiliated Zhoushan Hospital of Wenzhou Medical University",Journal of Medical Research,2015-03-15,Journals,5,Chronic lymphocytic thyroiditis;; Conventional ultrasound;; Contrast-enhanced ultrasound;,"Objective To improve the accuracy of preoperative diagnosis of conventional ultrasound combined with contrast-enhanced ultrasound（ CEUS） in the differential diagnosis of thyroid solid nodules with chronic lymphocytic thyroiditis（ CLT）. Methods Totally 108 thyroid solid nodules with CLT were examed by conventional ultrasound and contrast-enhanced ultrasound,which were confirmed by surgical pathology in Zhoushan Hospital,and there preoperative ultrasound images were revewed. A receiver operator characteris（ ROC） curve was constructed to assess the performance. Results Seven ultrasonographic features including margin,aspect ratio,echo,calcification,blood ditribution,heterogeneous enhancement and peak intensity were valuable in the diagnosis of malignant thyroid solid nodule with CLT. When combination of the seven parameters were used for the diognosis of malignant thyroid solid nodules with CLT,the percentage of correct prediction,the sensitivity and specificity were 86. 1%,87. 1%,84. 8%,respectively. Conclusion Conventional ultrasoud combined with contrast-enhanced ultrasound were valuable in the differential diagnosis of benign and malignant thyroid solid nodule,and improved the accuracy of preoperative diagnosis."
Characteristics of intrathyroidal branchial cleft cyst: a clinicopathological analysis of three cases,https://www.cnki.net/KCMS/detail/detail.aspx?dbcode=CJFD&filename=ZDBL201505003,"CHEN Bo;WU Huan-wen;MENG Yun-xiao;LIU Tong-hua;Department of Pathology,Peking Union Medical College Hospital,Peking Union Medical College,Chinese Academy of Medical Science",Chinese Journal of Diagnostic Pathology,2015-05-28,Journals,5,intrathyroidal;; branchial cleft cyst;; clinicopathological characteristics;,"Objective To explore the clinicopathological characteristics of intrathyroidal branchial cleft cyst. Methods Three cases of intrathyroidal branchial cleft cyst were studied with histopathological staining, and its clinical and pathological findings were analyzed with review of the literature. Results The patients（ 64,62 and 39 years old,respectively） were all diagnosed by physical check-up without any signs and symptoms. The lesions measured 10,8,and 7mm in the largest diameter,respectively. Grossly,all the lesions were soft nodules on cut surface,with cystic change in 1case. Histologically,the lesion was cystic lined by nonkeratinized squamous epithelium or pseudostratified columnar epithelium. The fibrous wall showed lymphocytic infiltration and lymphoid follicles in the subepithelial tissue.Conclusions Intrathyroidal branchial cleft cyst is extremely rare and therefore is easily misdiagnosed. Its diagnosis is based on distinctive histopathology. Surgical excision is the only way to remove the lesion."
慢性淋巴细胞性甲状腺炎致泛发性黏液性水肿1例,https://www.cnki.net/KCMS/detail/detail.aspx?dbcode=CJFD&filename=LCPF200901031,闫华;艾东方;马敬;王雪燕;季姗姗,Journal of Clinical Dermatology,2009-01-05,Journals,,"甲状腺炎,淋巴细胞性,慢性;; 水肿,黏液性;","＜正＞ 患者男,70岁。因面部、躯干、四肢出现红斑及丘疹1个月余,水肿1周,于2006年8月入院。患者于1个月前因冠心病在当地医院应用肝素和黄芪等治疗,其后皮肤逐渐出现红斑及丘疹,伴瘙痒,遂停药并给予抗过敏治疗,效果不明显,继而"
慢性淋巴细胞性甲状腺炎的诊治现状,https://www.cnki.net/KCMS/detail/detail.aspx?dbcode=CJFD&filename=ZGYI200908005,康骅;宁小晶,Chinese Journal of Medicine,2009-08-01,Journals,7,,"＜正＞ 慢性淋巴细胞性甲状腺炎（chronic lymphocyticthyroiditis,CLT）是甲状腺炎性疾病之一,1912年,日本九州大学桥本策医师在德国医学杂志上首先报告了4例本病,故又称桥本甲状腺炎（Hashimoto thyroiditis,HT）。目前多数学者认为CLT是自身免疫性疾病,而且是一种有明确遗传倾向的器官特异性自身免疫性疾"
中西医结合治疗慢性淋巴细胞性甲状腺炎的疗效观察,https://www.cnki.net/KCMS/detail/detail.aspx?dbcode=CJFD&filename=ZXJH201508036,刘国良,Cardiovascular Disease Journal of Integrated Traditional Chinese and Western Medicine,2015-03-18,Journals,12,慢性淋巴细胞性甲状腺炎;; 旋甲状腺素片;; 屏风消瘿汤;,"目的观察旋甲状腺素片联合屏风消瘿汤治疗慢性淋巴细胞性甲状腺炎的疗效。方法选取本院2010年12月~2014年1月收治的慢性淋巴细胞性甲状腺炎患者213例作为研究对象,随机分为治疗组107例及对照组106例。其中对照组患者给予旋甲状腺素片治疗;治疗组患者则在此基础上给予屏风消瘿汤治疗,治疗3个疗程后对两组患者的疗效进行对比。结果治疗后,治疗组患者总有效率为93.46%,显著高于对照组的76.42%,差异有统计学意义（P＜0.05）。结论旋甲状腺素片联合屏风消瘿汤治疗慢性淋巴细胞性甲状腺炎,疗效显著,同时还能够调节患者的机体免疫力,减少因停药而造成的疾病复发,值得临床推广应用。"
Clinical Analysis of the Diagnosis and Treatment of Chronic Lymphocytic Thyroiditis Associated With Thyroid Malignancy,https://www.cnki.net/KCMS/detail/detail.aspx?dbcode=CJFD&filename=JXUY201524072,MEN Bingling;Inner Mongolia Chifeng Second Hospital,China Continuing Medical Education,2015-09-30,Journals,,Thyroiditis;; Thyroid cancer;; Diagnosis and treatment;,"Objective To investigate the diagnosis and treatment of chronic lymphocytic thyroiditis associated with thyroid malignancy. Methods 20 cases of patients with chronic lymphocytic thyroiditis associated with thyroid malignancy diagnosis and treatment process were chosen. Results All patients were diagnosed by medical examination, serum thyroid antibodies were elevated, received surgical resection after 2 years, 16 people without recurrence and metastasis, 3 people died of his wounds, 1 cases lost contact. Conclusion Preoperative medical examination can improve the diagnosis rate. Surgical resection can be is effective in the treatment of chronic lymphocytic thyroiditis associated with thyroid malignancy."
Preliminary study on real-time ultrasound elastography quantitative tissue diffusion for diagnosis of Hashimoto′s thyroiditis,https://www.cnki.net/KCMS/detail/detail.aspx?dbcode=CJFD&filename=ZDLS201505013,"HE Zheng;XU Fei;WU Fan;GAO Zhiling;Department of Ultrasound, Shuguang Hospital Affiliated to Shanghai University of Traditional Chinese Medicine",Journal of Diagnostics Concepts & Practice,2015-10-25,Journals,4,Real-time ultrasound elastography;; Tissue diffusion;; Hashimoto′s thyroiditis;,"Objective: To assess the value of real-time elastography（RTE） quantitative tissue diffusion for the diagnosis of Hashimoto′s thyroiditis. Methods: Real-time ultrasound elastography was done in 46 cases of normal volunteers and 42 cases of patients with Hashimoto′s thyroiditis, quantitative analysis of tissue diffusion by dispersion diffusion index（LF index） were performed. Results: LF index in normal volunteer group was 1.217 6 ±0.800 0, and in Hashimoto′s thyroiditis group was 2.466 9±0.710 0. The difference in diffusion index between the two groups was statistically significant（P＜0.05）. Conclusions: RTE could reflect tissue elasticity of thyroid in patients with Hashimoto’s thyroiditis and has substantial clinical value for thyroid disease."
二陈祛瘿汤治疗慢性淋巴细胞性甲状腺炎的临床疗效观察,https://www.cnki.net/KCMS/detail/detail.aspx?dbcode=CJFD&filename=HQZY2015S2336,陈逢春,Global Traditional Chinese Medicine,2015-12-15,Journals,9,二陈祛瘿汤慢性淋巴细胞性甲状腺炎疗效;,"目的观察二陈祛瘿汤治疗慢性淋巴细胞性甲状腺炎的临床疗效。方法选取本院2015年1月~2015年11月门诊就诊的慢性淋巴细胞性甲状腺炎患者160例作为研究对象,随机分为治疗组80例和对照组80例。其中2组治疗8周后的疗效进行对比。结果经过8周的治疗,治疗组患者效果明显优于对照组,差异有统计学意义（P＜0.05）。结论二陈祛瘿汤治疗慢性淋巴细胞性甲状腺炎疗效显著,明显减低TPO抗体值,也可以提高患者的自身免疫力,减少疾病复发,值得临床推广。"
软坚消瘿汤治疗慢性淋巴细胞性甲状腺炎的临床疗效,https://www.cnki.net/KCMS/detail/detail.aspx?dbcode=CJFD&filename=WMIA201581098,刘美莲;杨亚茹,World Latest Medicine Information,2015-10-08,Journals,4,软坚消瘿汤;; 慢性淋巴细胞性甲状腺炎;; 临床疗效;,"目的探究软坚消瘿汤治疗慢性淋巴细胞性甲状腺炎的临床疗效。方法选用我院2013年8月至2014年8月收治的104例慢性淋巴细胞性甲状腺炎患者作为实验对象,将患者分为中药组和西药组各52例。西药组采用西医药物治疗,中药组采用软坚消瘿汤治疗。治疗4个月后,对比两组患者的临床疗效,评定疗效的指标为血清促甲状腺素（TSH）、抗甲状腺微粒体抗体（TMAb）、抗甲状腺球蛋白抗体（TGAb）、游离甲状腺素（FT4）和血清游离三碘甲状腺原氨酸（FT3）水平。结果中药组临床治疗总有效率82.69%明显高于西药组的总有效率65.38%,（P＜0.05）两组差异有统计学意义。结论软坚消瘿汤具有活血软坚、健脾祛痰的作用,可以改善甲状腺细胞功能,对治疗慢性淋巴细胞性甲状腺炎疗效明显。"
慢性淋巴细胞性甲状腺炎合并甲状腺乳头状癌34例的临床诊疗分析,https://www.cnki.net/KCMS/detail/detail.aspx?dbcode=CJFD&filename=ZOGU201602076,童珍君,China Higher Medical Education,2016-02-15,Journals,1,甲状腺乳头状癌;; 桥本病;; 临床特征;; 诊断;; 治疗;,"目的:分析慢性淋巴细胞性甲状腺炎合并甲状腺乳头状癌的临床特征、诊断、治疗方法和治疗效果。方法:回顾分析我院2011年6月至2013年12月收治的34例慢性淋巴细胞性甲状腺炎合并甲状腺乳头状癌患者的临床病例资料,总结分析桥本甲状腺炎合并甲状腺乳头状癌临床特征、诊断、治疗方法和治疗效果。结果:全组患者的发病年龄为26-57岁,中位年龄38岁,以女性（91.18%）为主,73.53%患者甲状腺功能正常,85.29%患者甲状腺球蛋白抗体及甲状腺过氧化酶抗体升高,甲状腺球蛋白抗体超过正常值50%的患者占58.82%,全体患者超声表现均显示甲状腺弥漫性增大,回声不均匀,甲状腺占位,低回声占64.71%,直径在3-17mm之间,纵横比失调23例（67.65%）,细小钙化16例（47.06%）,行患侧腺叶切除+峡部切除占61.76%,行甲状腺全切术占26.47%,行患侧腺叶切除+对侧腺叶次全切除占11.76%,所有患者均行中央区淋巴结清扫术,34例患者均未出现复发或远处转移情况,随访率100%。结论:桥本甲状腺炎与甲状腺乳头状癌的发生有一定的相关性,慢性淋巴细胞性甲状腺炎合并甲状腺乳头状癌多见于中年女性,易早期发生中央组淋巴结转移,原发灶腺叶加峡部切除术即可对于不伴有颈部淋巴结转移的桥本甲状腺炎合并甲状腺乳头状癌患者已经足够。"
慢性淋巴细胞性甲状腺炎与甲状腺恶性肿瘤的临床相关性因素分析,https://www.cnki.net/KCMS/detail/detail.aspx?dbcode=CJFD&filename=WMIA201629039,黄建芬;黄有全,World Latest Medicine Information,2016-04-08,Journals,2,慢性淋巴细胞性甲状腺炎;; 甲状腺恶性肿瘤;; 相关性;,"目的:研究分析慢性淋巴细胞性甲状腺炎与甲状腺恶性肿瘤的临床相关性因素。方法:选取2011年3月至2015年11月间在我院行手术治疗的528例甲状腺患者,对所有患者的临床资料进行回顾分析,对慢性淋巴细胞性甲状腺炎与甲状腺恶性肿瘤间的关系进行分析。结果:慢性淋巴细胞性甲状腺炎患者中有39.56%的患者合并甲状腺恶性肿瘤明显高于非慢性淋巴细胞性甲状腺炎患者（17.39%）,而两组患者的TNM分期相比较,差异不明显（P＞0.05）。结论:慢性淋巴细胞性甲状腺炎患者易并发甲状腺恶性肿瘤,但其对于肿瘤分期影响不大。"
硒酵母辅助左旋甲状腺素对慢性淋巴细胞性甲状腺炎伴甲减免疫调节的机制研究,https://www.cnki.net/KCMS/detail/detail.aspx?dbcode=CJFD&filename=HBYZ201610024,黄勇,Hebei Medical Journal,2016-05-26,Journals,29,甲状腺炎;; 甲状;; 硒酵母;; 左旋甲状腺素;,"目的观察硒酵母辅助左旋甲状腺素对慢性淋巴细胞性甲状腺炎伴甲减免疫调节的作用。方法将63例慢性淋巴细胞性甲状腺炎伴甲减患者随机分成2组,对照组31例进行左旋甲状腺素治疗,治疗组加服硒酵母,治疗6个月。结果 2组总有效率比较无统计学意义（P＞0.05）,但显效率之间比较有统计学意义,治疗组高于对照组（P＜0.05）。2组治疗后甲功FT3、FT4较治疗前升高,TSH及甲功抗体指标下降,虽未完全恢复至正常范围,但比较差异有统计学意义（P＜0.05）。2组FT3、FT4比较差异无统计学意义（P＞0.05）,TSH、TGAb及TPOAb指标比较,治疗低于对照组,比较差异有统计学意义（P＜0.05）。2组治疗后甲状腺体积明显缩小,差异有统计学意义（P＜0.05）,且治疗组治疗后体积明显低于对照组,差异有统计学意义（P＜0.05）。2组治疗后CD+8及NK升高,CD+4/CD+8、CD+4下降,且组间比较差异有统计学意义（P＜0.05）。结论硒酵母辅助左旋甲状腺素对慢性淋巴细胞性甲状腺炎伴甲减具有较好的免疫调节作用。"
超声对慢性淋巴细胞性甲状腺炎合并结节分类评估的价值,https://www.cnki.net/KCMS/detail/detail.aspx?dbcode=CJFD&filename=YWLC201607025,樊丽红;薛改琴;路艳斌;王瑜,Chinese Remedies & Clinics,2016-07-15,Journals,1,,"＜正＞慢性淋巴细胞性甲状腺炎（chronic lymphomatosa thyroiditis）又称为桥本甲状腺炎（Hashimoto′s thyroiditis,HT）,属于自身免疫病,成年女性最常见,起病隐匿,常合并不同性质结节。文献[1,2]报道HT患者中发现甲状腺结节相当普遍,但桥本病的超声实质背景表现复杂,超声对HT合并恶性结节的术前诊断率较低,文献报道为10%~40%。本文回顾性分"
Chronic lymphocytic thyroiditis and BRAF V600E in papillary thyroid carcinoma,https://www.cnki.net/KCMS/detail/detail.aspx?dbcode=CJFD&filename=ZDBL201702004,"LIU Zhi-ying;YANG Bo;Department of Pathology,the Fifth Affiliated Hospital,XinJiang Medical University;Department of Pathology,Affiliated Tumor Hospital,XinJiang Medical University",Chinese Journal of Diagnostic Pathology,2017-02-28,Journals,5,Papillary thyroid carcinoma;; BRAF mutation;; Chronic lymphocytic thyroiditis;; Extrathyroidal extension;; Immunohistochemistry;,"Objective To determine the clinical significance of chronic lymphocytic thyroiditis（ CLT） according to BRAF mutation status in papillary thyroid carcinoma（ PTC） patients. Methods 400 cases of specimen of PTC patients who underwent total thyroidectomy with bilateral central neck dissection were studied by useing of En Vision immunohistochemistry for BRAF mutation. Results The prevalence of BRAF mutation was significantly less frequent in conventional PTC patients with CLT（ 75. 9% vs. 83. 1%）. CLT was an predictor for low prevalence of ETE in both BRAFnegative and BRAF-positive conventional PTC patients. In addition,CLT was an independent predictor for low prevalence of CLNM in both BRAF-negative and BRAF-positive PTC patients. Conclusion BRAF mutation is significantly less frequent in PTC patients with CLT. However,CLT is a predictor for less aggressiveness in conventional PTC patients regardless of BRAF mutation status."
合并慢性淋巴细胞性甲状腺炎的甲状腺乳头状癌临床病理特点的研究进展,https://www.cnki.net/KCMS/detail/detail.aspx?dbcode=CJFD&filename=AZJZ201611007,董云伟;李小毅;商中华,Oncology Progress,2016-11-20,Journals,3,甲状腺乳头状癌;; 慢性淋巴细胞性甲状腺炎;; 临床病理特点;,"甲状腺乳头状癌是最常见的甲状腺恶性肿瘤,其发病率逐年增加,同时合并慢性淋巴细胞性甲状腺炎的甲状腺乳头状癌也在增加。甲状腺乳头状癌与慢性淋巴细胞性甲状腺炎的关系日益被人们所关注,二者的发病机制尚存在争议,然而合并慢性淋巴细胞性甲状腺炎的甲状腺乳头状癌有着较为独特临床病理特点。因此,了解其临床病理特点有助于临床评估及基础研究。"
Clinical effect of Ruanjian Xiaoying decoction on chronic lymphocytic thyroiditis,https://www.cnki.net/KCMS/detail/detail.aspx?dbcode=CJFD&filename=YLYS201709046,XU Yun-fang;Centers for Disease Control and Prevention of Yichuan County,Clinical Research and Practice,2017-03-30,Journals,6,chronic lymphocytic thyroiditis;; Ruanjian Xiaoying decoction;; thyroglobulin antibodies;,"Objective To study the clinical effect of Ruanjian Xiaoying decoction on chronic lymphocytic thyroiditis.Methods One hundred and twenty-four cases of patients with chronic lymphocytic thyroiditis admitted in our hospital from March 2014 to April 2015 were selected as the study objects. All the patients were divided into control group and study group according to the admission order, with 62 cases in each group. The control group received western medicine, while the study group accepted Ruanjian Xiaoying decoction. The clinical effect of two groups were compared. Results The total effective rate of the study group was 95.16%, which was higher than 82.26% of the control group（P＜0.05）. After treatment,the levels of TMAb, TGAb, FT4and FT3of the study group were better than those of the control group（P＜0.05）; there was no significant difference on TSH of two groups（P ＞0.05）. Conclusion Ruanjian Xiaoying decoction can be considered as one of the best treatment to chronic lymphocytic thyroiditis, its clinical effect is significant, and the clinical indexes can be improved significantly. It is worthy of clinical promotion value."
Erxian Xiaoying Decoction(二仙消瘿汤) combined with Levothyroxine Treatment of Hashimoto Thyroiditis Randomized Controlled Study,https://www.cnki.net/KCMS/detail/detail.aspx?dbcode=CJFD&filename=SYZY201701025,ZHU Sha;Zhanjiang Second Hospital of traditional Chinese medicine in the Department,Journal of Practical Traditional Chinese Internal Medicine,2017-01-16 13:24,Journals,4,hashimoto’s thyroiditis;; thyroid disease;; Erxian Xiaoying decoction（二仙消瘿汤）;; euthyrox;; TSH;; TT3;; TT4;; FT3;; FT4;; thyroid isthmus thickness;; TNF-α;; integrated traditional Chinese and western medicine therapy;; randomized controlled study;,"[Objective] To observe the Erxian Xiaoying decoction Combined with euthyrox efficacy of treatment of Hashimoto’s thyroiditis. [Method] The use of machine parallel control method, 70 cases of outpatient patients according to the order number by simple method were randomly divided into two groups. The control group of 35 cases of euthyrox. 35 cases in the treatment group Xiaoying Decoction（Erxian Chuanxiong 10 g, Curculigo 9g, Zhejiang Fritillaria, angelica 12 g, lujiaojiao 5g, Shudihuang 10 g, Xianlingpi the 15 g, yam, Cornus officinalis, 6G, 10g） Decoction 300 mL, 2 times/d day, sooner or later; westernmedicinew iththecontrolgroup. 1 months of continuous treatment for 1 course of treatment. Observe the clinical symptoms, thyroid isthmus thickness, TNF-alpha, TSH, TT3, TT4, FT3, FT4, bad reaction. After treatment of 3 course of treatment（3 months）, the curative effect. [Result] The treatment group 10 cases, 23 cases were stable, and 2 cases were ineffective, the total efficiency of 94.29%; the control group was 4 cases, 18 cases were stable, and 13 cases were ineffective, the total efficiency of 62.86%, the treatment group than the control group（P＜0.01）. Thyroid isthmus thickness, TNF-alpha, TSH, TT3, TT4, FT3 FT4, the treatment group was better than the control group（P＜0.01, P＜0.05）. [Conclusion] Erxian Xiaoying decoction combined with euthyrox treatment of Hashimoto thyroiditis, satisfactory curative effect, no serious adverse reactions, worthy of promotion."
二仙汤合芪海消瘿汤治疗慢性淋巴细胞性甲状腺炎伴甲状腺功能减退症疗效观察,https://www.cnki.net/KCMS/detail/detail.aspx?dbcode=CJFD&filename=XDJH201722012,黄娟;胡维;林湘东,Modern Journal of Integrated Traditional Chinese and Western Medicine,2017-08-01,Journals,22,二仙汤;; 芪海消瘿汤;; 慢性淋巴细胞性甲状腺炎;; 甲状腺功能减退症;,"目的观察二仙汤合芪海消瘿汤治疗慢性淋巴细胞性甲状腺炎伴甲状腺功能减退症的临床疗效。方法将80例慢性淋巴细胞性甲状腺炎伴甲状腺功能减退症患者随机分为治疗组与对照组各40例,2组均给予左旋甲状腺素治疗,治疗组在此基础上加用二仙汤合芪海消瘿汤治疗,疗程均为12周。观察2组临床疗效及治疗前后中医症状积分、甲状腺功能相关指标变化情况。结果 2组治疗后各项中医症状积分均较治疗前明显降低（P均＜0.05）,且治疗组较对照组降低更明显（P均＜0.05）;2组治疗后FT3、FT4均较治疗前明显升高（P均＜0.05）,TSH较治疗前明显降低（P＜0.05）,且治疗组各指标改善情况均明显优于对照组（P均＜0.05）;治疗后对照组甲状腺球蛋白抗体（TGAb）、甲状腺过氧化物酶抗体（TPOAb）及甲状腺大小均无明显改变（P均＞0.05）,治疗组上述指标较治疗前及同期对照组均有明显改善（P均＜0.05）。治疗组总有效率明显高于对照组（P＜0.05）。结论二仙汤合芪海消瘿汤治疗慢性淋巴细胞性甲状腺炎伴甲状腺功能减退症可有效改善临床症状、体征,降低抗体水平,值得推广应用。"
硒制剂对慢性淋巴细胞性甲状腺炎自身抗体的影响,https://www.cnki.net/KCMS/detail/detail.aspx?dbcode=CJFD&filename=ZDYX201714067,高宏霞;刘静;冯睿,Health Vocational Education,2017-07-25,Journals,2,硒制剂;; 慢性淋巴细胞性甲状腺炎;; 甲状腺过氧化物酶抗体;; 甲状腺球蛋白抗体;,"目的观察不同剂量硒制剂对慢性淋巴细胞性甲状腺炎（CLT）患者甲状腺过氧化物酶抗体（TPOAb）、甲状腺球蛋白抗体（Tg Ab）的影响。方法将130例CLT患者分为治疗组1、治疗组2和对照组,治疗组1（44例）给予硒酵母200μg/d,治疗组2（40例）给予硒酵母50μg/d,对照组（46例）随访观察3个月,分别于服药前、服药后3个月测定血清TPOAb、Tg Ab、血清促甲状腺激素（TSH）、游离甲状腺素（FT4）、游离三碘甲状腺原氨酸（FT3）水平及甲状腺各径线数值。结果补硒治疗后,治疗组1 TPOAb、Tg Ab水平较治疗前降低,差异有统计学意义（P＜0.05）;治疗组2 TPOAb、Tg Ab水平较治疗前降低,但差异无统计学意义（P＞0.05）。结论每日给予200μg硒可降低CLT患者TPOAb、Tg Ab水平,每日给予50μg硒对降低TPOAb、Tg Ab水平可能剂量不足。"
Risk factors of the chronic lymphocytic thyroiditis,https://www.cnki.net/KCMS/detail/detail.aspx?dbcode=CJFD&filename=JFJB201705015,"Li Hong;Wang Yongsen;Li Ping;Department of Internal Medicine,Cangzhou Psychiatric Hospital",Chinese Journal of Health Care and Medicine,2017-10-30,Journals,2,Chronic lymphocytic thyroiditis;; Morbidity;; Tonsillitis;; Coastal zone;,"Objective To discuss the possible risk factors in the development of chronic lymphocytic thyroiditis. Methods The people who had medical checks about thyroid in Cangzhou central hospital from June to December 2014 were enrolled. Among these people, 80 patients who were diagnosed as chronic lymphocytic thyroiditis were in the observation group, and 80 healthy subjects were in the control group. The factors such as gender,gene,regional differences,body mass index,city life,physical labor,education,family income and chronic tonsillitis were analyzed by logistic analysis. Results The prevalence of chronic lymphocytic thyroiditis was 6.01%（95% confidence interval 5.42%-6.59%）The difference of gender,gene,regional differences,chronic tonsillitis was statistically significant between two groups（β=-0.867,χ2=4.689,P=0.030）,（β=-0.712,χ2=4.140,P=0.042）,（β=0.633,χ2=6.392,P=0.011）,（β=1.471,χ2=12.931,P=0.000）. Conclusion The prevalence of chronic lymphocytic thyroiditis in Cangzhou city is about5.42%6.59%. Recurrent tonsillitis,coastal areas,women,gene are the risk factors of CLT."
