Title,URL,Author,Source,Date,Database,Quote,Keywords,Abstract
慢性淋巴细胞性甲状腺炎的超声诊断,https://www.cnki.net/KCMS/detail/detail.aspx?dbcode=CJFD&filename=ZMGY201210036,张月仙,Chinese Journal of Coal Industry Medicine,2012-10-20,Journals,1,"甲状腺炎,慢性淋巴细胞性;; 超声诊断;","＜正＞近年来,随着高频超声和彩色多普勒超声成像技术的发展,对甲状腺疾患的临床应用有了显著进展,经超声检查诊断甲状腺疾病的准确率逐步提高。慢性淋巴细胞性甲状腺炎为一种自身免疫性疾病,本研究通过对2009年2月—2011年8月我院经超声诊断慢性淋巴细胞性甲状腺炎（又称桥本病）例"
慢性淋巴细胞性甲状腺炎的诊断思路与治疗方法,https://www.cnki.net/KCMS/detail/detail.aspx?dbcode=CJFD&filename=XCYS201248013,蒙碧辉,Chinese Community Doctors,2012-12-23,Journals,1,,"＜正＞慢性淋巴细胞性甲状腺炎又称桥本甲状腺炎（HT）,起病缓慢,发病时患者大都没有特殊感觉,而是逐渐发现甲状腺肿大。少数晚期患者甲状腺体内有大量纤维化形成,坚硬如石,常与周围组织粘连,可发生进行性压迫症状,出现呼吸困难、吞咽困难等症状。本文以病例为基础,对HT的诊断思路和治疗方法作出总结。"
慢性淋巴细胞性甲状腺炎超声影像各型的放免指标分析,https://www.cnki.net/KCMS/detail/detail.aspx?dbcode=CJFD&filename=ZSZD201302039,葛冠男;赵凯军;梁雪;郭莉莉;郑美娜,Chinese Journal of Laboratory Diagnosis,2013-02-25,Journals,,,"＜正＞慢性淋巴细胞性甲状腺炎（chronic lymphocyt-ic thyroiditis,CTL）又称桥本甲状腺炎（HT）,是以甲状腺淋巴细胞浸润为病理特征的自身免疫性炎症,是甲状腺炎中最常见的疾病,常见于中年女性,近年来发病率呈上升趋势。据文献报道,Dailay首先提出甲状腺癌可由HT恶变而来[1]。Pollock也认为HT属癌前病变[2]。此外,HT常常与其它甲状腺疾病并存,如甲状腺癌、腺瘤、结节性甲状腺肿"
MSCT differential diagnosis of benign and malignant nodules in patients of chronic lymphocytic thyroiditis,https://www.cnki.net/KCMS/detail/detail.aspx?dbcode=CJFD&filename=ZYXX201304018,"ZHU Cai-song 1,YANG Jun 1*,YANG Jing 2,XU Ming 2,SHAO Kang-wei 1,LIU Wei 1,WANG Jia-lin 1,YUAN Li-xin 1,XIAO Zheng-guang 1,MIN Qing-hua 1,ZHANG Yi 1(1.Department of Radiology,2.Department of Pathology,Changning District Central Hospital,Shanghai 200336,China)",Chinese Journal of Medical Imaging Technology,2013-04-20,Journals,,"Thyroiditis,autoimmune;; Thyroid neoplasms;; Thyroid nodule;; Tomography,X-ray computed;","Objective To compare MSCT features of benign and malignant nodules in patients with chronic lymphocytic thyroiditis（CTL）,and to observe the value of MSCT in identification and diagnosis of these lesions.Methods MSCT findings,including the size,percentage of solid element,calcification,margin,capsule,the pattern and the degree of enhancement of 79thyroid nodules in 74patients with CLT were retrospectively analyzed,the differences of benign and malignant nodules were compared statistically.Results About 81.82%（18 / 22） malignant nodules were almost entirely solid,while 28.07%（16 / 57） benign nodules were mainly to cystic（all P＜0.05）.Malignant nodules more frequently appeared microcalcification and internal calcification than those of benign nodules（all P＜0.05）.Malignant nodules were likely to be ill-defined margin,lack capsule or insufficient capsule,homogeneous enhancement（all P＜0.05）.There was no significant differences between malignant and benign nodules in ratio of nodules and thyroid tissues outside nodules in plain,arterial phase,parenchymal phase（all P＞0.05）.Conclusion MSCT is helpful to differentiate benign and malignant nodules in CLT patients."
慢性淋巴细胞性甲状腺炎合并甲状腺微小乳头状癌16例分析,https://www.cnki.net/KCMS/detail/detail.aspx?dbcode=CJFD&filename=ZSSA201313101,孙萍,China Practical Medicine,2013-05-10,Journals,1,慢性淋巴细胞性甲状腺炎;; 甲状腺微小乳头状癌;,"目的探讨慢性淋巴细胞性甲状腺炎合并甲状腺微小乳头状癌的病因、诊断及治疗。方法回顾性分析我科2010～2011年收治的慢性淋巴细胞性甲状腺炎合并甲状腺微小乳头状癌16例患者的临床资料。结果 16例患者术前彩超均发现甲状腺低回声结节。10例TSH升高,16例甲状腺抗体检测均增高。所有患者均行手术治疗,均经术中冰冻病理确诊。结论慢性淋巴细胞性甲状腺炎合并甲状腺微小乳头状癌漏诊率高,诊断时需高度警惕。手术是有效的治疗方法。术中冰冻病理检查确诊率高。预后较好。"
Discussion on Application of Chinese Medicine with Iodine in Treatment of Chronic Lymphocytic Thyroiditis,https://www.cnki.net/KCMS/detail/detail.aspx?dbcode=CJFD&filename=LZXB201307077,"ZHANG Ying,Advisor :ZHANG Lan(Liaoning University of Traditional Chinese Medicine,Shenyang 110847,Liaoning,China)",Journal of Liaoning University of Traditional Chinese Medicine,2013-07-05,Journals,9,Chinese medicine with iodine;; chronic lymphocytic thyroiditis;; hashimoto’s thyroiditis;; academic discussion;,"The literature of Chinese medicine treatment of chronic lymphocytic thyroiditis was reviewed in the last decade,to explore how reasonable use of Chinese medicine with iodine."
隔药饼灸加左旋甲状腺素钠治疗慢性淋巴细胞性甲状腺炎,https://www.cnki.net/KCMS/detail/detail.aspx?dbcode=CJFD&filename=ZJZH201306019,徐惠芬,Zhejiang Journal of Integrated Traditional Chinese and Western Medicine,2013-06-20,Journals,54,慢性淋巴细胞性甲状腺炎;; 甲状腺功能减低;; 隔药饼灸;; 左旋甲状腺素钠;,"＜正＞慢性淋巴细胞性甲状腺炎是最常见的自身免疫性甲状腺疾病,是导致甲状腺功能减退症（甲减）的主要原因。多见于女性,起病缓慢,初期常无特殊不"
慢性淋巴细胞性甲状腺炎(CLT)合并甲状腺癌(TC)临床治疗分析,https://www.cnki.net/KCMS/detail/detail.aspx?dbcode=CJFD&filename=WSCY201321035,白小彬,China Health Industry,2013-07-25,Journals,,慢性淋巴细胞性甲状腺炎;; 甲状腺癌;; 诊断;; 治疗;,"目的探讨分析慢性淋巴细胞性甲状腺炎合并甲状腺癌患者在临床治疗中的特征、并发症以及预后状况。方法分析研究我院在1994—2004年之间收治的13例慢性淋巴细胞性甲状腺炎合并甲状腺癌的患者在临床治疗中的详细资料,对这些患者采取B超检查、FNAC检查、ECT检查,对患者进行手术治疗,手术后按常规服用优甲乐。结果经分析发现慢性淋巴细胞性甲状腺炎合并甲状腺癌的发病率占慢性淋巴细胞性甲状腺炎的12.15%（慢性淋巴细胞性甲状腺炎共有13例患者,其中,慢性淋巴细胞性甲状腺炎合并甲状腺癌有107例患者）占甲状腺癌的15.66%（慢性淋巴细胞性甲状腺炎癌83例患者,慢性淋巴细胞性甲状腺炎合并甲状腺癌例83患者）,所有的患者在手术前都主诉有颈前部结节,这些患者中1例有压迫症状、1例有颈部疼痛、6例TGA（或TMA）有时会出现同时升高、有8例患者出现同位素""冷冻结"",对这13例患者采用甲状腺超声检查,都显现出了低回声结节,特殊的2例患者伴有淋巴结肿大和钙化。这13例淋巴细胞性甲状腺炎合并甲状腺癌患者中12例患者进行一期根治性手术,1例患者进行二期根治性手术。结论慢性淋巴细胞性甲状腺炎合并甲状腺癌在前期诊断中比较困难,需要通过甲状腺相关抗体、影像学及手术中、手术后病理检查等手段综合应用;对于可疑病例必须谨慎检查。慢性淋巴细胞性甲状腺炎合并甲状腺癌的手术应该使用甲状腺癌根治性手术的原则进行手术治疗。"
儿童慢性淋巴细胞性甲状腺炎23例临床分析,https://www.cnki.net/KCMS/detail/detail.aspx?dbcode=CJFD&filename=DDKZ201308021,苏瑛;刘桂英,Chinese Journal of Contemporary Pediatrics,2013-08-22 18:04,Journals,,,"＜正＞慢性淋巴细胞性甲状腺炎（chronic lymphocytic thyroiditis,CLT）亦称为桥本甲状腺炎（Hashimotothyroiditis）。在学龄期儿童发病率可达1.2%,且有逐步增高趋势[1-2]。但是CLT起病缓慢,临床表现多样,可表现为甲状腺肿大而无自觉症状,亦可表现为甲状腺功能亢进或甲状腺功能减低。"
慢性淋巴细胞性甲状腺炎合并多灶性甲状腺乳头状癌46例诊治体会,https://www.cnki.net/KCMS/detail/detail.aspx?dbcode=CJFD&filename=XCYY201318015,叶登峰;李志安,Chinese Journal of Rural Medicine and Pharmacy,2013-09-15,Journals,1,慢性淋巴细胞性甲状腺炎;; 甲状腺乳头状癌;; 外科手术;,"目的总结慢性淋巴细胞性甲状腺炎（桥本病）合并多灶性甲状腺乳头状癌的诊治方法。方法回顾性分析46例桥本病合并多灶性甲状腺乳头状癌的临床资料。结果 46例桥本病合并多灶性甲状腺乳头状癌,其中34例（73.9%）甲状腺球蛋白抗体（TGAb）升高,4 6例抗甲状腺过氧化物酶抗体（TPOAb）均升高。4 6例均根据病情行不同形式手术治疗,同时行中央区淋巴结清扫。46例均获得随访,中位随访时间28个月。1例（2.2%）因一侧颈淋巴结转移而再次入院行改良颈淋巴清扫术。1例（2.2%）术后15个月残叶甲状腺癌复发行再次手术。结论桥本病伴多灶性甲状腺乳头状癌发生率较高,淋巴结转移率低,总体预后理想。TGAb、TPOAb、B超对术前诊断桥本病合并多灶性甲状腺癌有重要价值。"
Application of selenium yeast tablets for the treatment of chronic lymphocytic thyroiditis,https://www.cnki.net/KCMS/detail/detail.aspx?dbcode=CJFD&filename=JYYL201319018,"WU Dong-hong;LIU Jie;XU Bin-hua;LIANG Gui-min;CHEN Jing;LIU Da-na;Department of Endocrinology,Harbin First Hospital",Laboratory Medicine and Clinic,2013-10-14,Journals,11,selenium yeast tablets;; chronic lymphocytic thyroiditis;; thyroid peroxidase antibody;; thyroglobulin antibody;,"Objective To explore the application value of selenium yeast tablets（SYT）for the treatment of chronic lymphocytic thyroiditis（CLT）.Methods A total of 102patients with CLT were divided into experiment group（54cases）,treated with SYT and L-throxine（L-T4）and control group（48cases）,treated with（L-T4）alone or untreated.Serum levels of thyroid peroxidase antibody（TPOAb）,thyroglobulin antibody（TGAb）,thyrotropicstimulating hormone（TSH）,free triiodothyronine（FT3）and free thyroxin（FT4）were detected at admission and 6 months after therapy.Results The percentage of patients with decreased levels of TPOAb and TGAb in experiment group were 67%and 59%,which were higher than control group.Conclusion SYT treatment could prevent the further increasing of thyroid antibody level,postpone the damage of thyroid cells and protect thyroid tissue."
慢性淋巴细胞性甲状腺炎的超声诊断价值,https://www.cnki.net/KCMS/detail/detail.aspx?dbcode=CJFD&filename=KXJY201401061,秦丽微;郑春梅;曹霞,Heilongjiang Medicine and Pharmacy,2014-02-15,Journals,3,慢性淋巴细胞性甲状腺炎;; 超声诊断;; 声像图特征;,"目的:通过研究慢性淋巴细胞性甲状腺炎（HT）的超声检查声像图特征,以提高对HT的诊断价值。方法:用高频探头对42例已经被临床证实的HT患者检查,分析并总结HT的声像图特征,对声像图进行分类、对比研究。结果:HT超声声像图特征为甲状腺回声弥漫性不均、减低者占67%（其中包括回声弥漫性不均并夹杂条索样强回声）,甲状腺回声局限性减低者占10%,甲状腺回声弥漫性不均合并结节者占26%,42例HT患者甲状腺内径均有不同程度增大,以峡部的增厚为特征性表现;彩色多普勒均表现为弥漫性不均的实质内血流信号丰富,可呈""火海""样表现。结论:慢性淋巴细胞性甲状腺炎具有较为典型的超声声像图特征,能为临床明确诊断提供重要依据。"
Application of ER Xian Tang and QI Hai Xiao Ying Tang for the treatment of chronic lymphocytic thyroiditis complicated with hypothyroidism,https://www.cnki.net/KCMS/detail/detail.aspx?dbcode=CJFD&filename=JYYL201408008,"CHEN Qiong-ke;ZHENG Shi-xia;LIU Jing;Special Traditional Chinese Medicine and Western Medicine Department of Thyroid,the Third People′s Hospital of Chongqing;Endocrine Department,the Third People′s Hospital of Chongqing",Laboratory Medicine and Clinic,2014-04-28,Journals,19,traditional Chinese medicine;; chronic lymphocytic thyroiditis;; hypothyroidism;; levothyroxine;,"Objective To explore the curative effects of ER Xian Tang and QI Hai Xiao Ying Tang for the treatment of chronic lymphocytic thyroiditis（CLT）complicated with hypothyroidism.Methods A total of 70patients with CLT complicate with hypothyroidism were divided into treatment group,given Er Xian Tang,Qi Hai Xiao Ying Tang and levothyroxine sodium tablets,and control group,given evothyroxine sodium tablets.Curative effects, and serum levels of triiodothyronine（T3）,thyroxine（T4）,free triiodothyronine（FT3）,free thyroxine（FT4）,thyrotropic-stimulating hormone（TSH）,thyroglobulin antibody（TGAb）,thyroid peroxidase antibody（TPOAb）and so on were compared between the two groups.Results Before treatment,the differences of levels of T3,T4,TSH,FT3, FT4,TGAb,TPOAb and indexes of routine blood test between the two groups were not significant（P＞0.05）,and liver function of patients in the two groups were all without abnormality.After treatment,the effective rate in treatment group was 91.4%,being significantly different with the 74.3%in control group（P＜0.05）.After treatment, levels of T3,T4,FT3,FT4and TSH in the two groups all return to normal range,and levels of TGAb and TPOAb in treatment group were reduced,being significantly different with levels detected before treatment and with levels of control group（P＜0.05）.In treatment group,the dosage of levothyroxine reduced significantly（P＜0.05）.Thyroid volume reduced significantly only in treatment group（P＜0.05）.Conclusion Er Xian Tang and Qi Hai Xiao Ying Tang could effectively regulate immune function,reduce levels of TGAb,TPOAb and thyroid volume in patients with CLT complicated with hypothyroidism."
Clinical correlational research between CLT and malignant tumours of the thyroid,https://www.cnki.net/KCMS/detail/detail.aspx?dbcode=CJFD&filename=YIKE201408027,"Zhang Yi;Deng Fusheng;Liu Zhengrong;Dept of General Surgery,The Affiliated Provincial Hospital of Anhui Medical University",Acta Universitatis Medicinalis Anhui,2014-08-23,Journals,2,thyroiditis;; malignant neoplasm of thyroid gland;; correlation;,"Objective To discuss the clinical correlation between CLT and malignant tumours of the thyroid.Methods In this study,patients operated on for thyroid diseases in Anhui Provincial Hospital in 2012 were investigated retrospectively. Patients diagnosed as having CLT were investigated for any concurrent malignant neoplasm.44 patients in whom CLT and thyroid malignancy were coexisting were recruited in the study. Results In our study,the rate of malignancy against the background of CLT was 40. 7%,while the rate in the groups without CLT was18. 7%,with a statistically significant difference between the groups（P ＜ 0. 05）. There was no statistical difference in TNM classification between the groups with and without CLT. Conclusion The rate of throiditis coexistent with thyroid carcinoma is higher. The patients with microcalcifications,irrgular border or cervical lymphadenectasis in preoperative sonogram should be evaluated more carefully in terms of malignancy. CLT has no effect on clinical TNM classification of malignant tumours of thyroid."
Diagnosis and treatment of chronic lymphocytic thyroiditis coexistent with thyroid malignancy,https://www.cnki.net/KCMS/detail/detail.aspx?dbcode=CJFD&filename=YXQY201405045,"CAO Xiao-zheng;Department of Nuclear Medicine, The First Affiliated Hospital of Henan Science and Technology University",Chinese Journal of the Frontiers of Medical Science(Electronic Version),2014-05-20,Journals,1,Malignancy;; Chronic lymphocytic thyroiditis;,"Objective To explore the principles of diagnosis and treatment of chronic lymphocytic thyroiditis（CLT） coexistent with thyroid malignancy. Methods The clinical data of 38 patients with CLT, including clinic opathologic features, treatment, and prognosis were retrospectively analyzed. ResultsChronic lymphocytic thyroiditis with papillary carcinoma 29 cases, the merger medullary carcinoma 3 cases, combined lymphoma 6 cases. 35 cases received follow-up, the treatment effect of 86.84% patients was good. Conclusion Chronic lymphocytic thyroiditis thyroid malignant tumor in the combining more papillary carcinoma（29/38）. Preoperative thyroid function, serum thyroid antibody detection, B ultrasonic and intraoperative and postoperative biopsy can improve the diagnosis and treatment, and help to choose the right operation method."
Clinical Experience in Diagnosis and Treatment of 59 Cases of Chronic Lymphocytic Thyroiditis,https://www.cnki.net/KCMS/detail/detail.aspx?dbcode=CJFD&filename=JXUY201405020,"ZHAO Xiangyu;Sailike;Aleha;Shana;Surgery department, Xinjiang Aletai District People's Hospital",China Continuing Medical Education,2014-08-31,Journals,6,Chronic lymphocytic thyroiditis;; Diagnosis and Treatment;,"Objective To reduce the misdiagnosis of chronic lymphocytic thyroiditis rate, select reasonable treatment. Methods A retrospective summary of 1992~2012 were conducted for atypical chronic lymphocytic thyroiditis in 59 cases. Among the 59 cases, 50 cases received operation, 9 cases didn’t receive operation. Results 29 cases were simple Hashimotos disease, 11 cases were Hashimoto’s disease complicated with nodular goiter, 5 cases were Hashimoto’s disease coexistent with thyroid adenoma, 3 cases were Hashimoto’s disease coexistent with hyperthyroidism, 2 cases were Hashimoto’s disease associated with thyroid carcinoma. Conclusion Hashimoto’s disease misdiagnosis rate is high, fine needle aspiration biopsy, detection of antibodies to thyroglobulin（TGAB）, thyroid dry preparation diagnostic treatment and anti microsomal antibody（TMAB） can effectively improve the correct diagnosis rate."
Professor Zhu Liangzhen's experience in treating Hashimoto's Disease,https://www.cnki.net/KCMS/detail/detail.aspx?dbcode=CJFD&filename=SHZZ201407007,CAI Pu-yu;ZHU Liang-zheng;Tianshan Hospital of Traditional Chinese Medicine,Shanghai Journal of Traditional Chinese Medicine,2014-07-10,Journals,12,Hashimoto’s Disease;; regulating and invigorating liver and kidney;; experience;; Zhu Liangzheng;,"Professor Zhu Liangzheng views that liver and kidney have close relationship with Hashimoto’s Disease. Qi stagnation,phlegm coagulation and blood stasis are the branch of the disease; regulating and invigorating liver and kidney is the root of the disease. Regulating qi-flowing to eliminate phlegm and removing blood stasis to soften hardness are the two methods,which should be combined with. Local and holistic views on the disease at different stages should be considered in the treatment,and satisfied clinical efficacy has been achieved."
慢性淋巴细胞性甲状腺炎并甲状腺孤立性浆细胞瘤1例,https://www.cnki.net/KCMS/detail/detail.aspx?dbcode=CJFD&filename=SXLC201407028,闫勤英;张芬;杨森,Proceeding of Clinical Medicine,2014-07-10,Journals,,,"＜正＞患者,女性,74岁。2012年8月无意间发现左颈部肿块,无疼痛,未予重视。2013年2月发现肿块明显增大,于我院行甲状腺B超示:慢性淋巴细胞性甲状腺炎合并甲状腺左侧叶结节（见图1）;双侧颈部未见异常。查甲状腺功能示:三碘甲腺原氨酸（T3）1.68 nmol/L,甲状腺素（T4）102.06 nmol/L,游离三碘甲腺原氨酸（FT3）4.42 pmol/L,游离甲状腺"
弥漫性甲亢和慢性淋巴细胞性甲状腺炎的发病机理,https://www.cnki.net/KCMS/detail/detail.aspx?dbcode=CJFD&filename=GWLK197502008,张家庆,国外医学参考资料(内科学分册),1975-03-02,Journals,1,,"＜正＞ 目前认为弥漫性甲亢和慢性淋巴细性甲状腺炎的发病机理,极可能是与原发性免疫疾患有关。它们在遗传和发病机理上有特别紧密的联系。有关体液性免疫球蛋白的目前情况一、甲状腺自身抗体自从1956年发现血清的甲状腺抗体后,目前已发现在慢性淋巴细胞性甲状腺炎和弥漫性甲亢时都有各种甲状腺自身抗体,包括对甲状腺球蛋白的抗体、对甲状腺球蛋白以外的胶体成分的抗体、对甲状腺“微粒体”的抗体和抗核成分。这些抗体系由B淋巴细胞产生。最近有证据表明它们要与T淋巴细胞结合后才有细胞毒性。因此可能细胞免疫和体液性免疫两者对"
对流免疫电泳用于快速诊断慢性淋巴细胞性甲状腺炎,https://www.cnki.net/KCMS/detail/detail.aspx?dbcode=CJFD&filename=GWLK197512041,金慰鄂,国外医学参考资料(内科学分册),1975-12-27,Journals,,,"＜正＞ 自家免疫性甲状腺病的诊断,目前应用的有:美粘土絮状试验,甲状腺微粒体补体结合反应,鞣酸红细胞凝集试验,电沉淀素试验,萤光抗体测定,乳胶凝集试验等。至今最快速的试验是乳胶凝集试验,但成本昂贵。为此,作者以对流免疫电泳作为慢性淋巴细胞性甲状腺炎的快速诊断。材料和方法:选择1∶1的琼脂糖/“离子琼脂”,及pH 8.1的巴比妥醋酸缓冲液,配制1％琼脂糖和琼脂"
有甲状腺肿的甲状腺功能低下症在妊娠期间缓解一例报告,https://www.cnki.net/KCMS/detail/detail.aspx?dbcode=CJFD&filename=GWLK197605013,李兆寰,国外医学参考资料(内科学分册),1976-05-30,Journals,,,"＜正＞ 本文报告一例慢性淋巴细胞甲状腺炎因妊娠而发生较长期缓解。患者女性,21岁,于1971年11月临床诊断为慢性淋巴细胞甲状腺炎。患者用三碘甲状腺原氨酸（L3）治疗,最初剂量为25微克/日,以后增加到50微克/日。直到1972年6月15日,因妊娠停用甲状腺激素治疗至分娩以后。在妊娠第5个月复诊时,甲状腺功能正常,触诊甲状腺正常。检查血清甲状腺素（T4）12.2微"
慢性淋巴细胞性甲状腺炎合并乳腺癌,https://www.cnki.net/KCMS/detail/detail.aspx?dbcode=CJFD&filename=GWLK197701022,林增桃,国外医学参考资料(内科学分册),1977-01-31,Journals,,,"＜正＞ 本文根据4组30岁以上的女病例,探索乳腺癌和慢性淋巴细胞性甲状腺炎的关系。标准组由1810例慢性淋巴细胞性甲状腺炎的妇女患者组成。在1810例中,25％（450例）经组织学确诊,62％（1115例）经免疫学技术确诊,13％（245例）是根据实验室检查和"
慢性淋巴细胞性甲状腺炎20例临床分析,https://www.cnki.net/KCMS/detail/detail.aspx?dbcode=CJFD&filename=YIYA197803010,何戎华;陈家伟,Jiangsu Medical Journal,1978-04-01,Journals,4,,"＜正＞ 慢性淋巴细胞性甲状腺炎又称桥本氏病（Hashimoto氏病）,是非毒性甲状腺肿中比较常见的疾病之一,其发病率约为亚急性甲状腺炎的5倍,近年来发病率有增高趋势。在缺乏免疫学测定条件下一般不易及时诊断。本文搜集全部经病理确诊的20例进行临床分析,探索其诊断规律以供临床参考。临床资料: 一、性别及年龄:女16例,男4例,女:男为4:i。年龄13一60岁,其中36~60岁15例（75%）。二、家族史:皆为阴性。三、病程:自发病至就诊时间由1个月至10年不等,6个月以内了例,6月一1年3例,·艺2。1年一9年5例,10年以上2例,3例病程不详。"
慢性淋巴细胞性甲状腺炎30例临床分析,https://www.cnki.net/KCMS/detail/detail.aspx?dbcode=CJFD&filename=XYXX198003009,"怀建村,王庆兆",New Chinese Medicine,1980-03-31,Journals,2,,"＜正＞ 慢性淋巴细胞性甲状腺炎又称桥本氏病,系一种自家免疫性疾患。过去认为本病少见,近20余年来,国内外的发病率都在逐渐增加。但是,不少病例因术前甚至术中怀疑为甲状腺癌,甲状腺瘤或结节性甲状腺肿而施行手术者仍相当普遍。由于抗甲状腺抗体免疫测定尚未广泛开展,临床检查和术中探查仍是诊断"
HYPERTHYROIDISM AND CHRONIC LYMPHOCYTIC THYROIDITIS (REPORT OF 3 CASES),https://www.cnki.net/KCMS/detail/detail.aspx?dbcode=CJFD&filename=BANG198101011,"Gao Yinchun et al 
Departments of Internal Medicine and pathology,Bengbu Medical College,
Bengbu, Anhui",Journal of Bengbu Medical College,1981-04-02,Journals,1,,"Three cases were diagnosed as hyperthyroidism clinically. The thyroidectomy specimen showed histological features of chronic lymphocytic thyroiditis with or without an accompanying hyperplasia of the gland proper.         The pathogenesis of the coexistence of these two thyroid diseases and the mechanism of hyperthyroidism due to chronic lymphocytic thyroiditis are discussed.         In view that a correct preoperative. diagnosis is essential to effect a proper thera-py, it is suggested that a needle biopsy and immunological assay should be done pre-operatively especially in those cases the goiter appeared firm in consistency."
