Title,URL,Author,Source,Date,Database,Quote,Keywords,Abstract
Study on Chronic Lymphocytic Thyroiditis from Yin Fire Theory,https://www.cnki.net/KCMS/detail/detail.aspx?dbcode=CAPJ&filename=SYZY20231101007,LI Haoming;ZHANG Lan,Journal of Practical Traditional Chinese Internal Medicine,2023-11-02 10:52,Journals,,Yin fire theory;; chronic lymphocytic thyroiditis;; the fire of qi deficiency;; liver depression and spleen deficiency;; spleen-kidney Yang deficiency;,Based on Li Dongyuan’s Yin fire theory， this paper discusses the relationship between chronic lymphocytic thyroiditis and Yin fire，and holds that spleen deficiency is the foundation of the disease， liver depression and spleen deficiency and spleen kidney Yang deficiency are the different syndrome types of Yin fire evolution in Hashimoto’s disease during the abnormal A-function. Yin fire theory plays an important role in explaining the pathogenesis of Hashimoto’s disease and provides new ideas for clinical treatment.
慢性淋巴细胞性甲状腺炎外科治疗(附49例分析),https://www.cnki.net/KCMS/detail/detail.aspx?dbcode=CJFD&filename=BQEB200004043,"李文岗,丁田贵,孙毅群,张德恒",JOURNAL OF NORMAN BETHUNE UNIVERSITY OF MEDICAL SCIENCE,2000-07-30,Journals,1,慢性淋巴细胞性甲状腺炎;; 外科治疗;; 甲状腺自身抗体;,"目的 :研究手术加药物治疗对慢性淋巴细胞性甲状腺炎 （ CLT）的临床意义。方法 :对 4年间 49例病人进行回顾性分析 ,其中 2 0例病人行手术加药物治疗 ,2 9例病人给予单纯的药物治疗。结果 :手术加药物治疗组病人恢复快 ,复发少。对于一些不能排除恶性病变或伴随严重症状的病人 ,可以明确诊断。药物治疗组病人反复发作多 ,用药时间长。结论 :根据不同的病变范围 ,采用手术切除区域性病灶与药物治疗相结合的联合治疗 ,对 CLT不失为一种较满意的治疗方法。"
Role of cytokine imbalance mediated by nitric oxide in pathogenesis of chronic lymphocytic thyroiditis in children,https://www.cnki.net/KCMS/detail/detail.aspx?dbcode=CJFD&filename=XBFM200001015,"DONG Wen  bin,RAN Long  rui,XIAO Da  chengDepartment of Pediatrics, Affiliated Hospital of Luzhou Medical College, Luzhou 646000, Sichuan Province, China",JOURNAL OF CELLULAR AND MOLECULAR IMMUNOLOGY,2000-02-29,Journals,4,thyoiditis;; autoimmunity;; nitric oxide;; IFN  γ;; IL  4;,"Aim    To probe the role of serum nitric oxide（NO）in invasion of chronic lymphocytic thyroiditis（CLT） as a mediator of cytokine imbalance. Methods    NO concentration and IFN  γ/IL  4 levels produced by PBMC, and their relationships to thyroidal function were investigated in 13 children with CLT. Results   NO concentration and IFN  γlevel were significantly increased（P＜0.01）, while IL  4 level was markedly decreased（P＜0.01） compared with the control group. There were strong positive correlations between NO concentration and the levels of IFN  γand TSH（P＜0.05）. There were strong negative correlations between the NO concentration and the levels of IL  4, T3 and T4（P＜0.05）. Conclusion   NO could be involved in the development of chronic lymphocytic thyroiditis as a mediator of cytokines imbalance."
慢性淋巴细胞性甲状腺炎的临床特点,https://www.cnki.net/KCMS/detail/detail.aspx?dbcode=CJFD&filename=ZGWK200002004,王深明,CHINESE JOURNAL OF PRACTICAL SURGERY,2000-02-25,Journals,27,,
The effect of rhIL  10 on the imbalance of IFN  γ/IL  4 in children with  chronic lymphocytic thyroiditis,https://www.cnki.net/KCMS/detail/detail.aspx?dbcode=CJFD&filename=ZHEK200002017,"DONG Wenbin, XIAO Dacheng, RAN Longrui, et al. Department of Pediatrics, Affiliated Hospital, Luzhou  Medical  College, Sichuan 646000,China",Chinexe Journal of Pediatrics,2000-02-16,Journals,13,"Thyroiditis, autoimmune;; Interleukin  10;; Interleukin  4;; Interferon type Ⅱ;","Objective  To explore the effect of IL  10 on the imbalance of IFN  γ/IL  4 in children with chronic lymphocytic thyroiditis. Methods  The levels of IFN  γ, IL  4 in peripheral blood mononuclear cells （PBMC） before and after receiving recombinant interleukin  10 stimulation were determined by using ELISA in 10 children with chronic lymphocytic thyroiditis （CLT）.  Results  The levels of IFN  γ [（3 081±1 823）ng/L] and the ratio of IFN  γ/IL  4 10.1±5.4 increased （  P  ＜0.05） and IL  4 [（289± 32）ng/L] decreased （  P  ＜0.01） in children with CLT as compared with controls [（1 506 ± 578）ng/L, 5.0±3.1, （382±104）ng/L]. The increased IFN  γ and declined IL  4 were reversed by rhIL  10 （20 μg/L） to（1 831±1 562）ng/L and（381±125）ng/L , which were not significantly different from those of controls （  P  ＞0.05）.  Conclusion  IL  10 could redress the imbalance of Th  1/Th  2 type cytokine by inhibiting the synthesis of Th  1 type cytokine and inducing the production of Th  2  type cytokine."
儿童慢性淋巴细胞性甲状腺炎T细胞CD40L表达及其与细胞因子失衡的关联研究,https://www.cnki.net/KCMS/detail/detail.aspx?dbcode=CJFD&filename=ZHWS200001024,"董文斌,王菁,邓存良,肖大成",CHINESE JOURNAL OF MICROBIOLOGY AND IMMUNOLOGY,2000-01-30,Journals,1,,"为研究慢性淋巴细胞性甲状腺炎（ＣＬＴ）患儿发作期Ｔ细胞ＣＤ40ＬｍＲＮＡ表达及其与ＴＨ1/ＴＨ2细胞因子失衡的关系,以8例ＣＬＴ患儿为研究对象,采用ＲＴＰＣＲ技术和ＥＬＩＳＡ法分别检测在丝裂原诱导下外周血Ｔ细胞ＣＤ40ＬｍＲＮＡ的表达及单个核细胞（ＰＢＭＣ）产生Ｉ..."
The clinical observation of chronic lymphatic thyroiditis with treatment of Tripterygium Witfondii Hooh F,https://www.cnki.net/KCMS/detail/detail.aspx?dbcode=CJFD&filename=BANG200004012,"MOU Li  ping  (Department of Endocrinology,Affiliated Hospital of Bengbu Medical College,Anhui   233004  ,China)  [",JOURNAL OF BENGBU MEDICINAE COLLEGE,2000-07-15,Journals,15,thyroiditis;; Tripterygium Witfondii Hooh F;; prednisone;,"Objective:To observe the clinical efficiency of Tripterygium Witfondii Hooh F and prednisone in treatment for chronic lymphatic thyroitis（CLT）. Methods:Fifty female CLT patients without symptoms resulting from any change of thyroid funtion were divided by random sampling into A and B group（25 patients in each group）. All were treated with L  T\-4. On this base the patients in A group were plus with prednisone and ones in B with Tripterygium Witfondii Hooh F in three months. The blood T\-3,T\-4,TSH,TG  Ab,TPO  Ab and the changes of thyroid of the patients were determined before and after treatment. Results:The blood T\-3,T\-4 and TSH had no obvious change before and after medication. There was no difference in TG  Ab,TPO  Ab and the condition of thyroid compared between two groups,but there were significant differences to these data compared in pairs before and after treating（  P  ＜0.01）. In A group the patients complained obesity and 6 had edema and 2 weren’t given the medication owing to blood hypertension. However,all patients in B group had no side effect during the medical care. Conclusions:The treatment of CLT with Tripterygium Witfondii Hooh F is effective and safe,and may avoid side effect of prednisone.  ["
慢性淋巴细胞性甲状腺炎27例误诊分析,https://www.cnki.net/KCMS/detail/detail.aspx?dbcode=CJFD&filename=LCWZ200003066,王连武,CLINICAL MISDIAGNOSIS & MISTHERAPY,2000-06-17,Journals,1,,
慢性淋巴细胞性甲状腺炎的诊治体会(附22例报告),https://www.cnki.net/KCMS/detail/detail.aspx?dbcode=CJFD&filename=MDJB200003035,"陈文平,周立新,于文涛",JOURNAL OF MUDANJIANG MEDICAL COLLEGE,2000-09-30,Journals,,,
儿童慢性淋巴细胞性甲状腺炎8例,https://www.cnki.net/KCMS/detail/detail.aspx?dbcode=CJFD&filename=SXYY200002067,"武文斌,赵俊萍",SHANXI MEDICAL JOURNAL,2000-04-20,Journals,,,
慢性淋巴细胞性甲状腺炎误行手术18例分析,https://www.cnki.net/KCMS/detail/detail.aspx?dbcode=CJFD&filename=XCYY200007045,"琚惠军,何用如",Chinese Journal of Rural Medicine and Pharmacy,2000-07-15,Journals,,,"＜正＞ 18例慢性淋巴细胞性甲状腺炎均为女性,年龄25～63岁。均以颈前部肿块就诊,病史半月至5年不等。B超示:单侧甲状腺单个或多个实质性占位病变。临床误诊为单发性或多发性甲状腺瘤14例,甲状腺癌2例,功能性腺瘤2例。18例均手术,单侧甲状腺叶大部分切除5例,肿块局部切除10例,单纯活检3例。病理检查18例均为慢性淋巴细胞性甲状腺炎,其中2例合并毒性结节性甲状腺肿,1例合并甲状腺腺瘤。4例病人术后分别出现甲状腺功能低下而行替代疗法,最长达6年余,经随访未见明显副作用。"
Observation  of  The  laboratory  Test  And  histology  of  The  Children  and  Puberal  Chronic  Lymphocytic  Thyroiditis,https://www.cnki.net/KCMS/detail/detail.aspx?dbcode=CJFD&filename=ZYWB200001003,"Li  Jinqian,Liu  Ying,Zhang  Huimin,et  al.The  First  Hospital,West  China  University  of  Medicine  Sciences,Chengdu  610041",JOURNAL OF OCCUPATIONAL HEALTH AND DAMAGE,2000-03-30,Journals,,Thyroiditis  Needle  apirate  Thyroid  function  tests  Autologous  antibody;,"We  studied  a  total  of  37  children  and  juveniles  suffering  from  the  chronic  lymphocytic  thyroiditis.24  patients  diagrosed  by  needle  apirate  and  13  by  clinic  condition  or  intensive  position  of  antimicrosomal  and  antithyroglobulin  anti  bodies（AMA）and  （ATA）.Of  the  37  patients,27  have  normal  thyroid  function  tests  and  10  was  hypothyroidism.ATA  and  AMA  Were  positive  in  9  patient  of  24  whose  diagnosis  were  confirmed  by  needle  apriate  and  15  is  negative.In  the  present  study,we  initally  investgated  the  diagnostic  value  of  ATA,AMA  and  needle  apirate  to  children  and  puberal,Chronic  lymphocytic  thyroiditis  and  the  relation  amony  them."
慢性淋巴细胞性甲状腺炎20例分析,https://www.cnki.net/KCMS/detail/detail.aspx?dbcode=CJFD&filename=ZJKB200001022,付守志,Journal of Zhangjiakou Medical Collage,2000-02-15,Journals,,慢性淋巴细胞性甲状腺炎;; 自身免疫性甲状腺炎;,"通过对20例慢性淋巴性甲状腺炎（CLT）临床资料的分析,认为CLT具有不典型的特点;甲状腺自身抗体（TGA、MSA）测定和甲状腺细针抽吸细胞学检查（FNA）对CLT的诊断有重要价值;CLT手术治疗的目的只是为了解除压迫症状和排除恶变。"
慢性淋巴细胞甲状腺炎的诊断及治疗,https://www.cnki.net/KCMS/detail/detail.aspx?dbcode=CJFD&filename=SDYY200106064,班博,Shandong Medical Journal,2001-03-25,Journals,3,,
慢性淋巴细胞性甲状腺炎的穿刺细胞学图象,https://www.cnki.net/KCMS/detail/detail.aspx?dbcode=CJFD&filename=SHYY200101021,李伯利,Shanghai Journal of Medical Laboratory Sciences,2001-02-28,Journals,,淋巴细胞;; 甲状腺炎;,
慢性淋巴细胞性甲状腺炎并发恶性淋巴瘤及乳头状癌1例,https://www.cnki.net/KCMS/detail/detail.aspx?dbcode=CJFD&filename=ZHLC200104031,"周虹,刘文丽,郭晋,李凯声",Clinical Medicine of China,2001-04-30,Journals,3,甲状腺炎;; 淋巴瘤;; 乳头状癌;,
慢性淋巴细胞性甲状腺炎合并甲状腺恶性淋巴瘤一例,https://www.cnki.net/KCMS/detail/detail.aspx?dbcode=CJFD&filename=ZHNF200103026,"周湘兰,桂律",Chinese Journal of Endocrinology and Metabolism,2001-06-25,Journals,,,
慢性淋巴细胞性甲状腺炎72例临床分析,https://www.cnki.net/KCMS/detail/detail.aspx?dbcode=CJFD&filename=BZYB200103023,"李良增,王宝龙",Journal of Binzhou Medical College,2001-05-15,Journals,,甲状腺炎;; 甲状腺机能亢进;; 甲状腺机能减退;; 治疗;,
甲状腺炎患者血清唾液酸检测的应用价值,https://www.cnki.net/KCMS/detail/detail.aspx?dbcode=CJFD&filename=HCYX200110068,"王雪春,沈伟锋",Hebei Medicine,2001-10-30,Journals,,,
慢性淋巴细胞性甲状腺炎六例误诊分析,https://www.cnki.net/KCMS/detail/detail.aspx?dbcode=CJFD&filename=LCWZ200104077,彭钊,Clinical Misdiagnosis & Mistherapy,2001-08-17,Journals,,,
慢性淋巴细胞性甲状腺炎72例临床分析,https://www.cnki.net/KCMS/detail/detail.aspx?dbcode=CJFD&filename=LCYB200104046,"仕金让,李良增,高瑛",Journal of Linyi Medical College,2001-11-30,Journals,,甲状腺炎;; 甲状腺机能亢进;; 甲状腺机能减退;,
雷公藤多苷的临床新用途,https://www.cnki.net/KCMS/detail/detail.aspx?dbcode=CJFD&filename=SZGY200107079,"王莉,宋小俊",LiShiZhen Medicine and Materia Medica Research,2001-07-30,Journals,2,,
白细胞介素18在慢性淋巴细胞性甲状腺炎中的表达,https://www.cnki.net/KCMS/detail/detail.aspx?dbcode=CJFD&filename=ZDBL200102023,"杨京平,洪天配,裴斐",Chinese Journal of Diagnostic Pathology,2001-05-30,Journals,1,,
儿童慢性淋巴细胞性甲状腺炎12例临床分析,https://www.cnki.net/KCMS/detail/detail.aspx?dbcode=CJFD&filename=ZJYE200105015,"游欢庆,金献江,项如莲",Zhejiang Medical Journal,2001-05-25,Journals,1,,
慢性淋巴细胞性甲状腺炎误诊误治38例分析,https://www.cnki.net/KCMS/detail/detail.aspx?dbcode=CJFD&filename=ZWZX200107077,"方连法,许立恒,姜克宁",Chinese Journal of Misdiagnostics,2001-07-20,Journals,1,慢性淋巴细胞性甲状腺炎/诊断;; 误诊;,
γ干扰素/白细胞介素4比值失衡在儿童慢性淋巴细胞性甲状腺炎发病中的作用,https://www.cnki.net/KCMS/detail/detail.aspx?dbcode=CJFD&filename=ZHEK200201012,"董文斌,邓蕾丽",Chinexe Journal of Pediatrics,2002-01-16,Journals,1,,
慢性淋巴细胞性甲状腺炎合并甲状腺癌9例临床分析,https://www.cnki.net/KCMS/detail/detail.aspx?dbcode=CJFD&filename=ZHLC200212031,"杜勇健
,王新玮
,张立军",Clinical Medicine of China,2002-12-30,Journals,,甲状腺癌;; 慢性淋巴细胞性甲状腺炎;; 诊断;,"目的探讨慢性淋巴细胞性甲状腺炎合并甲状腺癌的诊断与治疗方法。方法总结 9例经病理诊断证实的慢性淋巴细胞性甲状腺炎合并甲状腺癌的病例 ,分析诊断与治疗中的经验教训。结果本组 9例术前、术中诊断均不全面 ,6例有甲状腺癌证据的患者采用了根治性手术 ,3例仅行部分切除术 ,病理诊断后又追加第 2次手术 ,术后口服甲状腺素治疗。结论对于症状不典型的甲状腺结节应采取综合全面的诊断方法 ,必要时手术探查和常规病理检查确诊。"
慢性淋巴细胞性甲状腺炎与HLA-A、-B和-DR关联的研究,https://www.cnki.net/KCMS/detail/detail.aspx?dbcode=CJFD&filename=BJMY200204022,"刘小莺,林益川,张芳林,沈晶晶,关晓蕾",Labeled Immunoassays and Clinical Medicine,2002-12-20,Journals,3,,
慢性淋巴细胞性甲状腺炎的临床诊断和治疗,https://www.cnki.net/KCMS/detail/detail.aspx?dbcode=CJFD&filename=NMYX200202015,"马高祥,尹剑波,傅佳晨,马列锋,刘颖斌,孟兴凯,彭承宏",Acta Academiae Medicinae Neimongol,2002-06-30,Journals,2,甲状腺炎;; 自身免疫;; 诊断;; 治疗;,
慢性淋巴细胞性甲状腺炎与HLA-A、-B、-DR关联的研究,https://www.cnki.net/KCMS/detail/detail.aspx?dbcode=CJFD&filename=XHYK200204033,"刘小莺,林益川,张芳林,沈晶晶,关晓蕾",Xuehui,2002-04-30,Journals,,,
Surgery for Chronic Lymphadenoid Thyroiditis,https://www.cnki.net/KCMS/detail/detail.aspx?dbcode=CJFD&filename=ZJYZ200205006,"SONG Zhi  ming, HANG Jian  ping, JING Zao  hui, GU Cheng  (Department of Neck Surgery,Jiang  yuan Hospital, Wuxi Jiangsu 214063,China)",Journal of Zhenjiang Medical College,2002-10-30,Journals,2,Chronic lymphadenoid thyroiditis;; Autoimmunity;; Malignant tumor;; Diagnosis;; Treatment;,"Objective:To discuss clinical behaviors,diagnosis and treatment.Methods: 95 cases of chronic lymphadenoid thyroiditis were summaried from January, 1997 to June,2002, and their clinical behaviors, symptoms, diagnosis and treatment were analyzed. Results:21 in 95 cases of chronic lymphadenoid thyroiditis were diagnosed clinically before operations. And 51 in 95 cases of nodular goiter,1 in 95 cases of hyperthyroidism, 13 in 95 cases of hypothyroidism and 9 in 95 cases of thyroid cancer were diagnosed clinically before operation. Pathological diagnosis revealed all the cases were chronic lymphadenoid thyroiditis.Correct rate of chronic lymphadenoid thyroiditis was 22.11% （21/95） while that of coexistence of thyroid cancer was 22.11%（21/95）. Conclusion: It is more likely to occur in middle females with coexistence of thyroid  malignant tumor, hyperthyroidism and hypothyroidism. A detailed understanding of its clinical features, combine with examination of FT  3, FT  4, TSH,TGAb, TMAb, TPO and FNAB will improve its properative diagnosis accuracy. Routine biopsy during operation is useful to select correctly operative methods."
Diagnosis and treatment of chronic lymphocytic thyroiditis,https://www.cnki.net/KCMS/detail/detail.aspx?dbcode=CJFD&filename=ZPWZ200205009,"MA Yi  1, MENG Gang  2 (1.Department of General Surgery, Affiliated Hospital, Wannan Medical College, Wuhu, Anhui 241001, China; 2.Department of Patholgy,Affiliated Hospital, Anhui Medical University,Anhui 230022,China)",Chinese Journal of General Surgery,2002-06-15,Journals,6,"THYROIDITIS,AUTOIMMUNE/diag;; THYROIDITIS,AUTOIMMUNE/ther;","Objective  To study the diagnosis of chronic lymphocytic thyroiditis （CLT）, and the treatment of CLT companied with other thyroid diseases. Methods  Clinical data of 63 cases of CLT were analyzed retrospectively. Results  26 cases were diagnosed by non-operative methods （11 cases by fine needle aspiration biopsy, FNAB）. The rest of 37 cases were operated on because of misdiagnosis as other thyroid disease and then comfirmed as CLT by pathology. Of them, 2 were companied with nodular goiter, 6 with Graves’ disease, 1 with thyroid adenoma and 2 with carcinoma, respectively. 19 cases were treated by thyroixine, 3 were not treated, 4 treated by operation after thyioxine managment and 37 were treated by operation. Non-operation group had rather satisfied effect in short-term period. 29 cases （78.4%） in operation group were followed up for 1 to 6 years, and 5 cases had hypothyroidism. Conclusions  It is necessary to have complete serum immunologic examination and FNAB for suspect patients.They have to be examined carefully in order to avoid omitting complications and incsease the rate of diagnosis.Non-operative treatment is the major therapy of CLT. If CLT is companied with other thyroid disease, operation or non- operation should be adopted according to the pathological type."
慢性淋巴细胞性甲状腺炎的诊断和治疗(附49例报告),https://www.cnki.net/KCMS/detail/detail.aspx?dbcode=CJFD&filename=ZXDY200222024,"陈新文
,张扬
,魏尚典
,黎有典",China Journal of Modern Medicine,2002-11-26,Journals,3,甲状腺炎;; 自身免疫性;; 诊断治疗;,"目的 :探讨慢性淋巴细胞性甲状腺炎 （CLT）的诊断 ,以及CLT合并其它甲状腺疾病的治疗方案选择。方法 :回顾性分析该院 1988～ 2 0 0 1年收治的 4 9例CLT的临床资料。结果 :术前诊断 11例 ,诊断率为 2 2 .4 %（11/ 4 9） ,其中经细针穿刺细胞学检查 （FNAC）诊断 10例 ,均予以甲状腺素片治疗 ,疗效满意。其余 38例分别误诊为其它甲状腺疾病而施行手术 ,其中合并甲亢 5例 ,合并结节性甲状腺肿 5例 ,合并甲状腺腺瘤 4例 ,合并甲状腺癌 3例 ;手术组中随访 2 7例 （71.1% ） ,6例发生甲低。结论 :全面的血清免疫学检查 ,结合FNAC检查可提高CLT的诊断率。该病以非手术冶疗为主 ,对合并其它病变者 ,应根据病理类型选择合理的治疗方案。"
陈如泉运用活血消瘿汤治疗慢性淋巴细胞性甲状腺炎经验,https://www.cnki.net/KCMS/detail/detail.aspx?dbcode=CJFD&filename=ZZYZ200206015,方邦江;周爽;鲁新华,Journal of Traditional Chinese Medicine,2002-06-15,Journals,50,"甲状腺炎,自身免疫性/中医药疗法;; @活血消瘿汤;; 名医经验;","＜正＞ 慢性淋巴细胞性甲状腺炎,又称桥本病,是一种自身免疫性疾病。兹将吾师湖北中医学院陈如泉教授运用自拟活血消瘿汤治疗慢性淋巴细胞性甲状腺炎的经验介绍如下。1 病机分析慢性淋巴细胞性甲状腺炎,属于中医“瘿病”范畴。分别类似于气瘿或肉瘿或石瘿。然而,该病不等于中医“瘿病”,中医“瘿病”还包括地方性甲状腺肿、单纯性甲"
慢性淋巴细胞性甲状腺炎并发甲状腺癌一例,https://www.cnki.net/KCMS/detail/detail.aspx?dbcode=CJFD&filename=BQEB200302043,"武晓丽
,孙琰",Journal of Norman Bethune University of Medical Science,2003-03-30,Journals,1,,
小剂量地塞米松局部注射治疗慢性淋巴细胞性甲状腺炎32例,https://www.cnki.net/KCMS/detail/detail.aspx?dbcode=CJFD&filename=LCFC200301029,"杜晓梅,陈文道",Clinical Focus,2003-01-15,Journals,1,"甲状腺炎,慢性淋巴细胞性;; 地塞米松;; 泼尼松;",
细针吸取细胞学诊断慢性淋巴细胞性甲状腺炎82例,https://www.cnki.net/KCMS/detail/detail.aspx?dbcode=CJFD&filename=SYQK200312042,"方先勇,柏涛,江涛",Journal of Applied Clinical Pediatrics,2003-12-20,Journals,6,"细针吸取细胞学;; 甲状腺炎,淋巴细胞性,慢性;; 儿童;",
Therapeutic effect of medicinal cake-separated moxibustion on chronic lymphocyte thyroiditis,https://www.cnki.net/KCMS/detail/detail.aspx?dbcode=CJFD&filename=ZGZE200301002,"Wang Xiaoyan (The Second Hospital of Jilin University, Changchun 130041, China)",Chinese Acupuncture & Moxibustion,2003-01-12,Journals,69,"Thyroiditis, Autoitnmune/acup ther;; Indirect Moxibustion;","Objective To observe the therapeutic effect of medicinal cake-separated moxibustion on chronic lymphocyte thyroiditis （Hashimoto’s disease）. Methods The treatment group （ n = 34 cases） were treated by medicinal cake-separated moxibustion, the medication group （n = 32） treated by oral administration of Thyroxine tablets, and normal thyroid function indexes were investigated in the normal control group （ n = 35）. The two states of hypothyroidism and normal thyroid function were analyzed. Results The medicinal cake-separated moxibustion could effectively improve the thyroid function and immunological function in the patient of Hashimoto’s disease （P ＜ 0.01）. Conclusion The cake-separated moxibustion is a better therapy for Hashimoto’s disease."
Evans综合征合并慢性淋巴细胞性甲状腺炎一例,https://www.cnki.net/KCMS/detail/detail.aspx?dbcode=CJFD&filename=ZHNK200310039,"井丽萍,张凤奎,薛峰,王迎,李洋,李刚,储榆林",Chinese Journal of Internal Medicine,2003-10-20,Journals,4,,
儿童慢性淋巴细胞性甲状腺炎76例临床分析,https://www.cnki.net/KCMS/detail/detail.aspx?dbcode=CJFD&filename=ZSEK200308017,"王德亮,解建军,张喜凤,王明经",Chinese Journal of Practical Pediatrics,2003-08-25,Journals,6,儿童;; 桥本病;; 甲状腺炎;,"目的 探讨儿童慢性淋巴细胞性甲状腺炎的临床表现特点、诊断方法及预后。方法 对76例慢性淋巴细胞性甲状腺炎患儿临床资料进行回顾性分析。结果 76例慢性淋巴细胞性甲状腺炎患儿,女性占81.59％,年龄为（10.52±3.12）岁,病程为（7.63±8.15）个月;全部病例均有甲状腺弥漫性肿大。初诊时临床表现为甲状腺功能亢进10例、甲状腺功能减低14例、无症状52例;初诊时临床诊断准确率为78.94％（60/76）,甲状腺针吸细胞学检查（FNAB）诊断准确率为98.68％（75/76）。随访2个月至4.5年,26例表现为甲状腺功能减低,32例甲状腺肿大消失,28例抗体降至正常;13例痊愈,痊愈病例中12例FNAB为淋巴型。结论 儿童慢性淋巴细胞性甲状腺炎临床表现不典型,易误诊;FNAB诊断准确率高,并可早期诊断;FNAB结合甲状腺自身抗体检查可作为儿童慢性淋巴细胞性甲状腺炎较可靠诊断手段;儿童慢性淋巴细胞性甲状腺炎近期预后良好,预后可能与细胞学类型相关。"
Clinical Analysis of Nodular Goiter Accompanied by Chronic Lymphocytic Thyroiditis,https://www.cnki.net/KCMS/detail/detail.aspx?dbcode=CJFD&filename=JYGZ200301032,"Tang Jian  jun,Sun Ke  jin,Kang Wen  qing,Bi ya,Qian Ye  pu  (Department of Surgery the 313 rd Hospital of PAL,Huludao 125000,Chima)",Journal of Clinical Medical officer,2003-02-28,Journals,4,nodular goiter;; chronic lymphocytic thyroiditis;; diagnosis;; treatment;,"Objective  Clinical experience in diagnosis and treatment of nodular goiter accompanied by chronic lymphocytic thyroiditis were discussed.Methods  22 cases of modular goitre accompanied by chronic lymphocytic thyroiditis were reviewed from 1989 to 2001.Results  All cases were surgically treated and diagnosed by pathology.Preoperative diagnostic  rate were 40.9%.According to different preoperative diagnosis.the various styles of thyrodectomy were performed.Postoperative hypothyroidism rate was 15.0%, and nodule recurrence rate was 9.1%.Conclusion  Both fine  needle aspiration biopsy and frozen stice are both useful in the diagnosis of nodular goiter accompanied by chronic lymphocytic thyroiditis.Accurate operative styles and resection range could prevent postoperative hypothyroidism and nodule recurrence effectively."
慢性淋巴细胞性甲状腺炎并发甲状腺结节的外科治疗,https://www.cnki.net/KCMS/detail/detail.aspx?dbcode=CJFD&filename=YWLC200305039,"任保元
,吴雨雷
,陈晋丽",Chinese Remedies & Clinics,2003-10-15,Journals,1,,
