Title,URL,Author,Source,Date,Database,Quote,Keywords,Abstract
Study on Traditional Chinese Medicine Constitution Distribution in Patients with Chronic Lymphocytic Thyroiditis Complicated with Thyroid Nodules,https://www.cnki.net/KCMS/detail/detail.aspx?dbcode=CJFD&filename=REND202312011,"PENG Xin
;XU Rongjuan
;XU Yijun
;YIN Haoqiang",New Chinese Medicine,2023-06-25,Journals,1,Chronic lymphocytic thyroiditis;; Traditional Chinese meidicne constitution;; Thyroid nodules;,"Objective:To observe the distribution rule of traditional Chinese medicine（TCM） constitution distribution in patients with chronic lymphocytic thyroiditis（CLT） and its relationship with thyroid nodules.Methods:A total of 233 CLT physical examination patients were included and performed TCM constitution identification and thyroid ultrasonography. The TCM constitution distribution and its relationship with thyroid nodules were investigated. Results: The highest proportion of single constitution was qi deficiency constitution（83.69%）,blood stasis constitution（78.54%）,qi constraint constitution（58.80%）,damp-heat constitution（42.92%）,phlegm-damp（30.90%） and yin deficiency constitution（30.90%）. Patients with qi deficiency constitution, blood stasis constitution, qi constraint constitution and inherited special constitution were significantly older than those without corresponding constitution（P＜0.05）,and patients with yin deficiency constitution were younger than those without yin deficiency constitution（P＜0.05）. In patients with two constitutions, there were more with qi deficiency and blood stasis constitution（71.67%）, qi deficiency and phlegm-damp constitution（63.95%）, phlegm-damp and blood stasis constitution（58.80%）,qi deficiency and qi constraint constitution（52.79%）,qi constraint and blood stasis constitution（47.64%） and qi constraint and phlegm-damp constitution（47.21%）,who were significantly older than those without corresponding constitution（P＜0.05）,and patients with qi deficiency and phlegmdamp constitution were significantly younger than those without that constitution（P＜0.05）. In patients with three constitutions,there were more with constitution of qi deficiency,phlegm-damp and blood stasis（44.64%）, constitution of qi deficiency, qi constraint and blood stasis（39.06%）, constitution of qi constraint,phlegm-damp and blood stasis（38.63%）,and constitution of qi deficiency,qi constraint and phlegm-damp（38.20%）. In patients with four constitutions, there were more with constitution of qi deficiency,blood stasis,phlegm-damp and qi constraint（34.76%）,and they were significantly older than those without that constitution（P＜0.05）. The majority of constitution type was four constitutions（51.93%）.Patients with three,four and five constitutions were significantly older than those with single constitution and two constitutions（P＜0.05）,and they had a higher proportion of multiple thyroid nodules than that in patients with single constitution（P＜0.05）. Patients with four and five constitutions were significantly older than those with three constitutions,and they had a higher proportion of multiple thyroid nodules than that in patients with two constitutions and three constitutions（P＜0.05）. Conclusion: CLT patients are mainly characterized by biased constitution and mixed constitution. The older the age, the more complex the constitution, the more mixed constitution, and the higher the proportion of multiple thyroid nodules. It suggests that the clinical diagnosis and treatment of the disease should be taken into account the multiple constitution factors,and should avoid over-simple syndrome differentiation,so as to improve the clinical effect."
"Efficacy of decoction for clearing liver,dissipating binds,dispersing goiter combined with levothyroxine on chronic lymphocytic thyroiditis with hypothyroidism",https://www.cnki.net/KCMS/detail/detail.aspx?dbcode=CJFD&filename=XDJH202322006,LI Xin'ai;DING Zhiguo;GENG Wenqian;YUAN Jiaojiao;WU Yanke;QIAN Jiahui;HU Rui;CHEN Zhi;LI Zhe;Dongzhimen Hospital of Beijing University of Chinese Medicine;SUN Simiao Hospital of Beijing University of Chinese Medicine;Hospital Thyroid Disease Hospital of SUN Simiao Hospital of Beijing University of Chinese Medicine;Thyroid Disease Institute of SUN Simiao Research Institute of Beijing University of Chinese Medicine;Tongchuan Thyroid Disease Prevention Center;Tsinghua Changgeng Hospital of Tsinghua University;Wuhan Hospital of Chinese Medicine,Modern Journal of Integrated Traditional Chinese and Western Medicine,2023-11-25,Journals,,"chronic lymphocytic thyroiditis;; hypothyroidism;; decoction for clearing liver,dissipating binds,dispersing goiter;; inflammatory cytokines;","Objective It is to investigate the clinical efficacy, safety of decoction for clearing liver, dissipating binds, dispersing goiter combined with levothyroxine on chronic lymphocytic thyroiditis（CLT） with hypothyroidism and its effect on serum inflammatory factors. Methods Eighty-nine patients with CLT with hypothyroidism were selected from Department of Thyroid Diseases of SUN Simiao Hospital and Dongzhimen Hospital of Beijing University of Chinese Medicine from May 2022 to May 2023, and divided into control group（n=45） and observation group（n=44） according to their treatment wishes, and 30 healthy volunteers were recruited as the healthy group. The patients of the control group and observation group were required to limit iodine diet, additionally, the control group was given levothyroxine tablets orally, and the observation group was given decoction for clearing liver, dissipating binds, dispersing goiter+levothyroxine tablets. Both groups were treated for 8 weeks. The levels of thyroid-related autoantibodies, thyroid function indexes [serum free triiodothyronine（FT3）, free tetraiodothyronine（FT4）, and thyroid-stimulating hormone（TSH）], traditional Chinese medicine syndrome scores, thyroid disease syndrome group scores, lower extremity localized edema scores before and after treatment, and the efficacy of Chinese medicine syndrome, and safety were compared between the control group and observation group, and the levels of serum interleukin-2（IL-2）, interleukin-12（IL-12）, and monocyte chemotaxis protein 1（MCP-1） in subjects of the healthy group and 30 patients（randomly selected） of the observation group before and after treatment were measured. Results The serum levels of thyroid peroxidase antibody（TPOAb） after treatment were significantly lower and the level of FT4 level was significantly higher than those before treatment in the observation group（all P＜0.05）, but the differences were not statistically significant compared with the control group（all P＞0.05）. The traditional Chinese medicine syndrome scores, thyroid disease syndrome group scores, lower extremity localized edema scores of the observation group after treatment were significantly lower than those before treatment and of the control groups（all P＜0.05）. The serum levels of IL-2, IL-12, and MCP-1 of 30 patients of the observation group were significantly higher than those of the healthy group before treatment（all P＜0.05）, and they were significantly decreased after treatment compared with before treatment（all P＜0.05）. The total effective rate of Chinese medicine syndrome efficacy of the observation group was significantly higher than that of the control group after treatment [86.36%（38/44） vs. 35.56%（16/45）,P＜0.05], and no adverse events occurred in patients of both the control and observation groups after treatment. Conclusion Decoction for clearing liver, dissipating binds, dispersing goiter combined with levothyroxine can obviously reduce the levels of thyroid antibodies, improve thyroid function and clinical symptoms, and alleviate inflammatory reactions in the treatment of CLT with hypothyroidism."
慢性淋巴细胞性甲状腺炎,https://www.cnki.net/KCMS/detail/detail.aspx?dbcode=CJFD&filename=FACT201317005,刘睿;关海霞,Chinese Practical Journal of Rural Doctor,2013-09-01,Journals,1,慢性淋巴细胞性甲状腺炎;; 桥本甲状腺炎;; 诊断;; 治疗;,本文主要介绍慢性淋巴细胞性甲状腺炎的病因、发病机制、临床表现、诊断和治疗方法。
The mechanism research and modeling method of Hashimoto's Thyroiditis of experimental NOD mice,https://www.cnki.net/KCMS/detail/detail.aspx?dbcode=CJFD&filename=LICX201707005,Ye Zhipeng,Zhejiang Clinical Medical Journal,2017-07-25,Journals,1,Hashimoto’s Thyroiditis;; Iodine;; Modeling;; Th cell;,"Objective To investigate mechanism research and modeling method of Hashimoto’ s Thyroiditis of experimental NOD mice.Method 20 NOD mice were divided equally into model group and normal group,and were separately fed with diet of iodine（0.64 g NaI/L） and distilled water.Eight weeks later,thyroid tissue and plasma were collected to observe the histopathological changes of thyroid gland and the level of anti TG antibody in plasma.IFN-γ and interleukin-4（IL-4） produced by splenocytes were measured by enzyme-linked immunosorbent assay.Result（1） Compared with control group by histopathology detection,NOD mice developed CLT in normal group was less than that of the model group,which was obviously different（P＜0.05）.（2） There was a difference in serum mTgAb among the both groups,and had statistical significance.（P＜0.05）.（3） In the model groups,the IL-4 was lower,IFN-γ and IFN-γ/IL-4 were higher than that of the normal group.Conclusion It is feasible to establish a model of chronic lymphocytic thyroiditis induced by iodine in mice.Adequate iodine can promote the secretion of Th1 cytokine including IFN-γ and suppress Th2 cytokine including IL-4,which results in the disorder of Th1/Th2,and even Th1 cells take a more important role."
Clinical effect of selenium yeast combined with levothyroxine sodium on type 2 diabetes complicated with chronic lymphocytic thyroiditis,https://www.cnki.net/KCMS/detail/detail.aspx?dbcode=CJFD&filename=ZGYG201711020,"Zhang Cheng;Zeng Fei;Liu Xiaoping;Yang Yali;Li Hong;Kang Chuanzhe;Department of Pharmacy,the 452 Hospital of the Chinese People's Liberation Army",China Medicine,2017-11-08,Journals,17,Diabetes mellitus;; Chronic lymphocytic thyroiditis;; Selenium yeast;,"Objective To observe the clinical effect of selenium yeast combined with levothyroxine sodium on type 2 diabetes complicated with chronic lymphocytic thyroiditis（ CLT）. Methods Totally 78 type 2 diabetic patients with CLT from June 2015 to November 2016 in the 452 Hospital of the Chinese People’s Liberation Army were randomly divided into group A and group B, with 39 cases in each group. Group A took levothyroxine sodium tablets based on basic hypoglycemic therapies; group B took selenious yeast tablets in addition. Blood glucose,thyroid function indexes, clinical efficacy and adverse reactions were analyzed. Results Levels of fasting blood glucose, postprandial 2 h blood glucose, glycosylated hemoglobin, thyroid peroxidase antibody and thyroglobulin antibody after treatment in group B were significantly lower than those in group A[（5. 00 ±0. 10） mmol/L vs（5.60±0.30）mmol/L,（8.50±0.40）mmol/L vs（10.60±0.40）mmol/L,（4.70±0.20）% vs（5.80 ±0. 13）%,（119 ± 19）mU/L vs（290 ±31）mU/L,（87 ±19）mU/L vs（172 ±22）mU/L]; levels of fasting C peptide and postprandial 2 h C peptide after treatment in group B were significantly higher than those in group A[（2.06±0.21）μg/L vs（1.27 ±0.22） μg/L,（5.27 ±0.43） μg/L vs（2.63 ±0.26） μg/L]（ all P＜ 0.05）.The total effective rate in group B was significantly higher than that in group A [94. 9%（37/39） vs 69. 2%（27/39）]（P ＜0. 05）. After treatment, improvement rate of clinical symptoms（ thyroid pain, swelling and myxedema） in group B was significantly higher than that in group A（P ＜0. 05）. The incidence rate of adverse reactions in group B was significantly lower than that in group A[0.0%（0/39） vs 10. 3%（4/39） ]（P ＜0. 05）. Conclusion Selenium yeast combined with levothyroxine sodium treating type 2 diabetes with CLT is effective in relieving symptoms,reducing adverse reactions and improving life quality."
慢性淋巴细胞性甲状腺炎,https://www.cnki.net/KCMS/detail/detail.aspx?dbcode=CJFD&filename=FACT201502022,王嫘,Chinese Practical Journal of Rural Doctor,2015-01-15,Journals,1,甲状腺炎;; 慢性;; 淋巴细胞性;,文章介绍慢性淋巴细胞性甲状腺炎的诊断要点、治疗方案和说明。
Effect of Levothyroxine Sodium Combined with Selenium in the Treatment of Chronic Lymphocytic Thyroiditis with Hypothyroidism,https://www.cnki.net/KCMS/detail/detail.aspx?dbcode=CDFD&filename=1021716292.nh,孙春萍,Chinese Doctoral Dissertations Full-text Database,2021-03-01,Doctoral Dissertations,1,Hashimoto’s thyroiditis;; emotion;; plasma immune factor;; levothyroxine sodium;; selenium treatment;,"Objective In this study,we explored the effects of chronic lymphocytic thyroiditis（Hashimoto’s thyroiditis（HT））on emotional cognition and immune inflammatory cytokines,and explored the effects of left thyroid sodium combined with selenium on HT.MethodsThe subjects were selected from HT patients in the Enendocrinology Department of the First Affiliated Hospital of Anhui Medical University.According to the inclusion and exclusion conditions,178 patients（HT group）were selected.According to the different thyroid hormone levels,they were divided into 156 patients with hypothyroidism（HT group）and 22 patients with normal HT thyroid function（HT normal group）.Another 24 healthy volunteers（control group）were recruited.Thyroid function indexes（TT3,TT4,TSH,TPOAB,TGAB）and plasma immunoinflammatory cytokines（IL-1β,IL-6 and TNF-α levels）were detected in HT group and control group.Self-rating Anxiety Scale（SAS）,Self-rating Depression Scale（SDS）and Simple Mental State Examination（MMSE）were used to detect anxiety,depression and mental state of patients in each group.A total of 156 patients with HT hypothyroidism were randomly divided into two groups: the monotherapy group was treated with levothyroxine sodium（LT4）replacement therapy,and the combination therapy group was treated with LT4 combined with selenium.After 6 months of treatment,the therapeutic efficacy,adverse reactions and goiter of HT group before and after treatment were observed,and the changes of thyroid function indexes,blood selenium level,anxiety and depression status and plasma immune inflammatory cytokines were analyzed.Result1.There were no significant differences in general clinical data between HT group and control group,such as age,gender,living environment,education level,smoking history and alcoholism history（P＞ 0.05）.2.Compared with the control group,TT3 and TT4 were significantly decreased in HT hypothyroidism group,while TSH,TPOAB and TGAB were significantly increased（P＜0.05）.TPOAB and TGAB were significantly increased in HT normal group,but TT3,TT4 and TSH were not statistically significant（P＞0.05）.3.The overall SAS and SDS scores of HT patients were higher than those of the control group（P＜0.05）.However,there was no significant difference in MMSE scores between the two groups.4.The positive rates of anxiety and depression in HT hypothyroidism group and HT normal group were higher than those in healthy control group（P ＜ 0.05）.The positive rates of anxiety and depression were the highest in HT hypothyroidism group,followed by normal HT group and the lowest in healthy control group（P ＜ 0.05）.5.The scores of SAS and SDS in HT hypothyroidism group and HT normal group were higher than those in healthy control group（P ＜ 0.05）.The scores of SAS and SDS in HT hypothyroidism group were significantly higher than those in HT normal group（P ＜ 0.05）.6.The plasma levels of immunoinflammatory cytokines IL-1β,IL-6 and TNF-α in HT group and HT normal group were higher than those in control group（P＜0.05）.Further pairwise comparison showed no significant difference in the levels of these inflammatory factors between the normal HT group and the HT hypothyroidism group.7.Pearson correlation analysis showed that SAS score and SDS score were positively correlated with TT3,TT4,TPOAB,TGAB,IL-1β,IL-6 and TNF-α（P＜0.05）.8.The monotherapy treatment group was treated with levothyroxine sodium replacement therapy,while the combined treatment group was treated with levothyroxine sodium combined with selenium supplementation.There were no differences in age,BMI,gender,living environment,education level,smoking history,alcoholism history,family history and ethnicity between the combined treatment group and the monotherapy group（P ＞0.05）.9.The total effective rate of the combined treatment group was 97.73%,and that of the monotherapy treatment group was 88.24%.The total effective rate of the combined treatment group was significantly higher than that of the monotherapy treatment group,with statistical significance（P＜0.05）.10.Before treatment,the indexes of anterior and posterior diameter of thyroid in two groups were similar,without statistical significance（P＞0.05）;After treatment,the anterior and posterior diameters of left lobe,isthmus and right lobe in two groups were smaller than before treatment,and the combined treatment group was significantly smaller than the single treatment group,with statistical significance（P＜0.05）.11.The serum selenium level of two groups was similar before treatment,and the difference was not statistically significant（P ＞0.05）.After treatment,the blood Se level of the combined treatment group was significantly increased,and the blood Se level of the combined treatment group was significantly higher than that of the single group,with statistical difference（P ＜ 0.05）.12,two groups of patients before treatment TT3,TT4,TSH levels are similar,no statistical difference（p ＞ 0.05）,two groups of patients after treatment TT3,TT4 level were significantly elevated,and patients with combined treatment group was obviously higher than that of single treatment group patients（p ＜ 0.05）,the TSH levels were significantly reduced,and the joint treatment group patients was significantly lower than that of single treatment group patients（p ＜ 0.05）.It was confirmed that the improvement of thyroid function in the combined treatment group was significantly better than that in the single treatment group.13.The levels of thyroid autoantibodies TG-Ab and TPO-Ab in two groups were similar before treatment,without significant difference（P＞0.05）.After treatment,the levels of TG-Ab and TPO-Ab in 2 groups were lower than before treatment,and the patients in the combined treatment group were significantly lower than those in the single treatment group（P＜0.05）.14.Before treatment,SAS and SDS scores of two groups were similar,and the difference was not statistically significant（P＞0.05）.After treatment,SAS and SDS values in two groups were lower than before treatment,and SAS and SDS values in the combined treatment group were significantly lower than those in the single treatment group,with statistical significance（P＜0.05）.15.Before treatment,the levels of serum IL-1β,IL-6 and TNF-α in 2 groups were similar,and there was no statistical significance（P＞0.05）.After treatment,the levels of IL-1β,IL-6 and TNF-α in 2 groups were decreased,and the difference was statistically significant（P ＜ 0.05）.After treatment,the level of IL-1β in combined treatment group was lower than that in monotherapy group,and the difference was statistically significant（P ＜ 0.05）.There was no significant difference in the levels of IL-6 and TNF-α between the two groups after treatment（P＞0.05）.16.The incidence of adverse reactions in the combined treatment group was 7.95%,and that in the monotherapy group was 19.12%.The incidence of adverse reactions in the combined treatment group was significantly lower than that in the monotherapy group,with statistical difference（P＜0.05）.Conclusion1.HT affects mood and plasma Immunoinflammatory factor.2.Selenium improves the treatment effect of levothyroxine sodium in HT patients with hypothyroidism."
张兰教授治疗慢性淋巴细胞性甲状腺炎经验选萃,https://www.cnki.net/KCMS/detail/detail.aspx?dbcode=CMFD&filename=2009031790.nh,张春华,Chinese Master's Theses Full-text Database,2008-04-01,Master's Theses,2,慢性淋巴细胞性甲状腺炎;; 桥本氏病;; 中医药治疗;; 经验;,"Chronic Lymphocytic Thyroiditis （CLT）, named as Hashimoto’s Thyroiditis（HT）, is very normal in the diseases of the thyroid gland, which takes about 20% of the diseases of the thyroid gland. It occurs primarily in the females, especially the mid-edged females. In recent years, the disease in clinical morbidity rate is gradually increased, which can be associated with thyroid cancer or lymphoma. Western medicine thinks it has a relationship with the autoimmunication. As a result, it also named autoimmune Thyroditis. However, the western medicine has no effect therapy to the irregulation of the disease. Professor Zhang has got particular and affluent experience to this kind of disease after dealing with medicine many years. She has concluded a distinctive theory of how to treat CLT with Traditional Chinese Medicine, which bases on the three zang-organs----the liver, the spleen and the kidney, and divided into three stages, and get satisfactory clinical effect."
